approveDate,commentBody,commentID,commentSequence,commentTitle,commentType,createDate,depth,editorsSelection,parentID,parentUserDisplayName,permID,picURL,recommendations,recommendedFlag,replyCount,reportAbuseFlag,sharing,status,timespeople,trusted,updateDate,userDisplayName,userID,userLocation,userTitle,userURL,inReplyTo,articleID,sectionName,newDesk,articleWordCount,printPage,typeOfMaterial
1491040505,with all trumps dodgy cabinet and advisor picks washington is beginning to look as reputable as al capones chicago ,22001207.0,22001207,<br/>,comment,1491025487.0,1,False,0.0,nan,22001207,https://graphics8.nytimes.com/images/apps/timespeople/none.png,7.0,nan,0.0,nan,0,approved,1.0,0.0,1491040505,ben luk,78335343,australia,nan,nan,0,58def3237c459f24986d7c84,unknown,oped,823.0,23,oped
1491040505,love that last point to see flynn locked instead would be ironic indeed,22000878.0,22000878,<br/>,comment,1491020118.0,1,False,0.0,nan,22000878,https://graphics8.nytimes.com/images/apps/timespeople/none.png,14.0,nan,0.0,nan,0,approved,1.0,0.0,1491040505,cbourne,76822372,bc canada,nan,nan,0,58def3237c459f24986d7c84,unknown,oped,823.0,23,oped
1491040505,lets hope that the curse extends to all the republicans n congress and the democrats make great strides in 2018  as angry as people were in town halls over healthcare imagine how angry people will be when they find out that trumps tax reform mans beaks for corporations and millionaires and next to nothing for them,22000815.0,22000815,<br/>,comment,1491019412.0,1,False,0.0,nan,22000815,https://graphics8.nytimes.com/images/apps/timespeople/none.png,4.0,nan,0.0,nan,0,approved,1.0,0.0,1491040505,jerry s,23397057,chelsea,nan,nan,0,58def3237c459f24986d7c84,unknown,oped,823.0,23,oped
1491040505,it is fruitless to attempt to persuade most people that their allegiance to a favored political party is misguided this allegiance is no more rational than most fans commitments to their favored professional sports teambrbri have noticed that some people cease being fans of a team when that pro team moves to a different city in a different statebrbrsince as ms collins columns frequently indicate the gop has moved to a different planet in an alternative reality shouldnt a good many republicans be looking for a new team,22000029.0,22000029,<br/>,comment,1491012527.0,1,False,0.0,nan,22000029,https://graphics8.nytimes.com/images/apps/timespeople/none.png,7.0,nan,0.0,nan,0,approved,1.0,0.0,1491040505,andrew g bjelland sr,58063917,salt lake city utah,nan,nan,0,58def3237c459f24986d7c84,unknown,oped,823.0,23,oped
1491040505,thank you for this you nailed it 45 is a disaster on every level for the democracy for the environment for the world as we know it his friends and supporters have only themselves to blame for not understanding that they are part of the biggest con in our lifetime,22000026.0,22000026,<br/>,comment,1491012512.0,1,False,0.0,nan,22000026,https://graphics8.nytimes.com/images/apps/timespeople/none.png,19.0,nan,0.0,nan,0,approved,1.0,0.0,1491040505,gwen krause,36404651,troy ny,nan,nan,0,58def3237c459f24986d7c84,unknown,oped,823.0,23,oped
1491040504,all we got out of the the citizens united supreme court ruling is a political system stuffed with stupid drones,22001692.0,22001692,<br/>,comment,1491039668.0,1,False,0.0,nan,22001692,https://graphics8.nytimes.com/images/apps/timespeople/none.png,9.0,nan,0.0,nan,0,approved,1.0,0.0,1491040504,steve bolger,67892453,new york city,nan,nan,0,58def3237c459f24986d7c84,unknown,oped,823.0,23,oped
1491040504,we can all laugh a bit now but the scary time is approaching for the empire of trump you might remember the movie empire of the sun about the japanese shortlived empire during wwii john malkovich said it best as the prisoner basie talking about when it gets really dangerous and scary in the prisoner of war camp its at the beginning and end of war that we have to watch out in between its like a country clubbrbrif and when the empire of trump starts to go down for good it could get really scary we all need to stay frosty trump and his supporters could get nasty very quickly  meanwhile lets have a wellearned laugh,22001149.0,22001149,<br/>,comment,1491024353.0,1,False,0.0,nan,22001149,https://graphics8.nytimes.com/images/apps/timespeople/none.png,1.0,nan,0.0,nan,0,approved,1.0,0.0,1491040504,smc,6179698,lexington,nan,nan,0,58def3237c459f24986d7c84,unknown,oped,823.0,23,oped
1491040503,look at kellyanns net worth and pay before you feel sorry for her i believe spicer is making 65000000 this year for his briefing talent and holding the press at bay not many in media with those figures ,22001369.0,22001369,<br/>,comment,1491029549.0,1,False,0.0,nan,22001369,https://s3.amazonaws.com/pimage.timespeople.nytimes.com/6116/8150/cropped-61168150.jpg?0.7292408785396534,4.0,nan,2.0,nan,0,approved,1.0,0.0,1491040503,annette johnson,61168150,texas,nan,nan,0,58def3237c459f24986d7c84,unknown,oped,823.0,23,oped
1491040503,dont forget kelly ann im sure her political career is over perhaps she could help ivanka on qvc,22000938.0,22000938,<br/>,comment,1491020846.0,1,False,0.0,nan,22000938,https://graphics8.nytimes.com/images/apps/timespeople/none.png,3.0,nan,0.0,nan,0,approved,1.0,0.0,1491040503,larry,69077966,lexington ma,nan,nan,0,58def3237c459f24986d7c84,unknown,oped,823.0,23,oped
1491040503,except for the coal miners i dont know who ild save if i were on a sinking ship maybe chris christie because he has experience in this sort of thing and that whole flotation device thing,22000889.0,22000889,<br/>,comment,1491020221.0,1,False,0.0,nan,22000889,https://graphics8.nytimes.com/images/apps/timespeople/none.png,5.0,nan,0.0,nan,0,approved,1.0,0.0,1491040503,rick gage,64318277,mt dora,nan,nan,0,58def3237c459f24986d7c84,unknown,oped,823.0,23,oped
1491040503,if it wasnt so serious it would be delightful  hehehehe or jajajajaja,22000178.0,22000178,<br/>,comment,1491013640.0,1,False,0.0,nan,22000178,https://graphics8.nytimes.com/images/apps/timespeople/none.png,1.0,nan,0.0,nan,0,approved,1.0,0.0,1491040503,publicus,65188575,seattle,nan,nan,0,58def3237c459f24986d7c84,unknown,oped,823.0,23,oped
1491040502,gail please add the state dept employees to this list 13000 foreign service employees 11000 civil service employees 45000 foreign service local employees because they have to deal with rex tillersonbrbrthese poor public servants have been warned to never speak to their boss or even have eye contact should they run into him in the halls  and when tillerson pays a visit overseas he never goes to american embassies to meet the ambassador if there are any left under trumps lazygolfplaying tenure and americans who put their lives on the line to try and keep the peace around the worldbrbrthanks gail for reminding us that maga is still only a trumpster campaign slogan proffered these days just for laughs,22001367.0,22001367,<br/>,comment,1491029490.0,1,False,0.0,nan,22001367,https://s3.amazonaws.com/pimage.timespeople.nytimes.com/2188/0515/cropped-21880515.jpg?18047928021656499968,21.0,nan,0.0,nan,0,approved,1.0,0.0,1491040502,barbie coleman,21880515,washington dc,nan,nan,0,58def3237c459f24986d7c84,unknown,oped,823.0,23,oped
1491040502,this was so funny,22000280.0,22000280,<br/>,comment,1491014461.0,1,False,0.0,nan,22000280,https://graphics8.nytimes.com/images/apps/timespeople/none.png,1.0,nan,0.0,nan,0,approved,1.0,0.0,1491040502,christopher,50704288,carpenter,nan,nan,0,58def3237c459f24986d7c84,unknown,oped,823.0,23,oped
1491040502,as earnest and serious this column is im thankful gail could make me laugh the wand shortage comment was especially priceless please keep us laughing  its better than crying,22000148.0,22000148,nan,comment,1491013365.0,1,False,0.0,nan,22000148,https://graphics8.nytimes.com/images/apps/timespeople/none.png,3.0,nan,0.0,nan,0,approved,1.0,0.0,1491040502,holly hadlock,78305019,mill valley ca,nan,nan,0,58def3237c459f24986d7c84,unknown,oped,823.0,23,oped
1491040501,trumpfinger the man with the touch of lead,22000216.0,22000216,<br/>,comment,1491013941.0,1,False,0.0,nan,22000216,https://graphics8.nytimes.com/images/apps/timespeople/none.png,0.0,nan,0.0,nan,0,approved,1.0,0.0,1491040501,oneiric,37076710,stockton,nan,nan,0,58def3237c459f24986d7c84,unknown,oped,823.0,23,oped
1491040427,but seriously is any of this registering with the people who voted for him  will any of this help the democrats regain control of congress  or is it just good snl material,21999995.0,21999995,<br/>,comment,1491012307.0,1,True,0.0,nan,21999995,https://graphics8.nytimes.com/images/apps/timespeople/none.png,661.0,nan,9.0,nan,0,approved,1.0,0.0,1491040428,james,57663081,panams,nan,nan,0,58def3237c459f24986d7c84,unknown,oped,823.0,23,oped
1491040039,this post is for the future not those reading in the present  there were decent people in this era they were just in the minority,22001364.0,22001364,<br/>,comment,1491029424.0,1,True,0.0,nan,22001364,https://graphics8.nytimes.com/images/apps/timespeople/none.png,314.0,nan,7.0,nan,0,approved,1.0,0.0,1491040039,george,67045630,nc,nan,nan,0,58def3237c459f24986d7c84,unknown,oped,823.0,23,oped
1491032707,birds of a feather flock together if a person is ignorant selfcentered politically inexperienced and administratively incoherent what do you expect him to do in choosing his friends and assistants  by the gail you forgot the ineffable kellyanne  too bad she isnt a lawyer otherwise with her singular interpretation of facts she would make the perfect trump nominee for the supreme court,22001470.0,22001470,<br/>,comment,1491032652.0,1,False,0.0,nan,22001470,https://s3.amazonaws.com/pimage.timespeople.nytimes.com/1755/5430/cropped-17555430.jpg?0.8385502484161407,56.0,nan,7.0,nan,0,approved,1.0,1.0,1491032707,frank,17555430,durham,nan,nan,0,58def3237c459f24986d7c84,unknown,oped,823.0,23,oped
1491027606,ryan was not only going to lose the big health care battle he was going to look like an idiot doing itbrbrtrump did not do that to ryan ryan did it to himself brbrhe always had to do it to himself when once he got the chance to do something about health care he is evil his ideas are evil and once he got the chance to put his ideas on display this is the only possible outcome brbruntil now he promised vaguely and covered with a magic asterisk actual opportunity forced him to reveal himself trump did not do that to him it was inherentbrbractually we all knew that about him krugman told us in detail repeatedly for years many were just unwilling to believe it so long as ryan could blow smoke ,22001304.0,22001304,<br/>,comment,1491027547.0,1,False,0.0,nan,22001304,https://s3.amazonaws.com/pimage.timespeople.nytimes.com/3767/4938/cropped-37674938.jpg?0.41398809710517526,208.0,nan,3.0,nan,0,approved,1.0,1.0,1491027606,mark thomason,37674938,clawson mich,nan,nan,0,58def3237c459f24986d7c84,unknown,oped,823.0,23,oped
1491026347,you forgot to mention poor crazy kellyanne havent seen much of her lately think all her pathological lying has caused her to loose touch with reality ,22001246.0,22001246,<br/>,comment,1491026324.0,1,False,0.0,nan,22001246,https://s3.amazonaws.com/pimage.timespeople.nytimes.com/3174/0333/cropped-31740333.jpg?0.9480581504758447,136.0,nan,4.0,nan,0,approved,1.0,1.0,1491026347,philip s wenz,31740333,corvallis oregon,nan,nan,0,58def3237c459f24986d7c84,unknown,oped,823.0,23,oped
1491019448,as much as i dislike the president you have to admit he surrounds himself with very colorful characters janine pirroyou couldnt make that voice up if you triedbrbrand nunes we know the president never progressed beyond fifth grade but the chair of the congressional intelligence committee  what a namelikely sort of stayed in third gradebrbrof course what he lacks in brains he makes up for in energy and inventivenessbri mean nobody really really cared how he got to the white house did he have to ask that gratuitous touch about changing carsbrbrits pretty clear that donald trump doesnt have a lot of time to be president if he spending all his time watching his staff perform on tv when i think of how hard president obama worked spending five hours a night on briefing papers addition to his day job im pretty sure im safe in saying i doubt he watched josh earnest on tvbrbrsomehow i get the feeling trump isnt having a lot of fun being president or even playing president his face is looking more tired and depressed as each day passes if he looks like he does now after 70 days but will be look like at 100brbrbut if hes not having fun just imagine all his minionsnot to mention his constituents   youre not alone donald we arent having any fun either,22000813.0,22000813,<br/>,comment,1491019385.0,1,False,0.0,nan,22000813,https://s3.amazonaws.com/pimage.timespeople.nytimes.com/2073/520/cropped-2073520.jpg?0.18587254704312467,652.0,nan,5.0,nan,0,approved,1.0,1.0,1491019448,christine mcm,2073520,massachusetts,nan,nan,0,58def3237c459f24986d7c84,unknown,oped,823.0,23,oped
1491017767,a gallery of rogues and enablers but one should include in that gallery most of the republican members of congress a thick skin or skull and not mind the mud flying all over the place is the minimum requirement to stick close to trump ,22000659.0,22000659,<br/>,comment,1491017734.0,1,False,0.0,nan,22000659,https://s3.amazonaws.com/pimage.timespeople.nytimes.com/4563/7812/cropped-45637812.jpg?0.7362245436322047,133.0,nan,0.0,nan,0,approved,1.0,1.0,1491017767,serban,45637812,miller place,nan,nan,0,58def3237c459f24986d7c84,unknown,oped,823.0,23,oped
1491016687,i just want to thank our socalled president for giving fatal coal a second chance to kill and maim a new generation of americansbrbrtrumps dirty power plan ensures that americas typically 500 megawatt coalfired electricity plant continues to produce these grand old poisonsbrbr37 million tons of carbon dioxide the main greenhouse gas and leading cause of global warmingbrbr10000 tons of sulfur dioxide the main cause of acid rain which damages forests lakes and buildingsbrbr500 tons of small particles that cause lung damagebrbr220 tons of smogcausing hydrocarbonsbrbr720 tons of carbon monoxide a poisonous gas brbr125000 tons of toxic ash and 193000 tons of toxic sludgebrbr225 pounds of arsenic 114 pounds of lead 4 pounds of cadmium and many other toxic heavy metals known to contaminate lakes and rivers and the fish in thembrbr22 billion gallons of waterbrbramerica needs filthy fatal coal energy like the average person needs strychnine poisoningbrbrand of course coal jobs are largely automated these days so there are no coal jobs coming back in the dying coal industry as natural gas solar and wind energy technologies accelerate and put coal out of permanent businessbrbrbut it was a magnificent political deception of the fraudsterinchief to dupe some whites r us hillbillies into voting for a billionaire scrooge whos getting ready to rip out the american safety net in exchange for a river of toxinsbrbrdonald trump making coal pollution great againbrbrdrop dead america,22000540.0,22000540,<br/>,comment,1491016625.0,1,False,0.0,nan,22000540,https://s3.amazonaws.com/pimage.timespeople.nytimes.com/5187/8992/cropped-51878992.jpg?0.3028964879922569,1388.0,nan,18.0,nan,0,approved,1.0,1.0,1491016687,socrates,51878992,verona nj,nan,nan,0,58def3237c459f24986d7c84,unknown,oped,823.0,23,oped
1491016567,what a rogues gallery of miscreants  taking them down is almost too easy like shooting fish in a swampbrbrit seems that the entire government has taken on the personality of the president proving once and for all that stupidity is contagious  republicans who were content to merely obstruct good government are now in the spotlight and all they can do is engineer dysfunctionbrbreight years of bush made them complacent  eight years of obama doused any light they may have had left and reduced them to impotently voting against obamacare over and over again  winning the presidency the house and the senate didnt change anythingbrbrit couldnt happen to a more deserving bunch of nincompoops chief among them being paul ryan  it turned out that ryan only appeared smart when democrats were there to squelch his ideas  once they were allowed flourish in a friendly atmosphere of republican hot air they suffocated and diedbrbrnow republicans are just belligerent poseurs pretending to have ideas  they were once ideologues  take away the ideas and theyre just logs floating in that fetid swampbrbrthings arent looking good  the voters who put them in charge are having second thoughts  the gop is in disarray fighting against itself  key players are seeking immunity even worse putin is buy tying up loose ends with extreme prejudice  nobody is smilingbrbrexcept hillary,22000535.0,22000535,<br/>,comment,1491016530.0,1,False,0.0,nan,22000535,https://graphics8.nytimes.com/images/apps/timespeople/none.png,736.0,nan,12.0,nan,0,approved,1.0,1.0,1491016567,gemli,57048689,boston,nan,nan,0,58def3237c459f24986d7c84,unknown,oped,823.0,23,oped
1491013148,we are all victims of the trump curse  some innocent others deserving  the most deserving other than those americans who voted for him is paul ryan   why  he has been touted as the policy wonk the brains of the republican party but he has been shown up for what he is  just another republican hack casting all pretense of intellect aside and taking whatever advantage he can to try to push through an ideological agendabrbrhe should swallow hard and begin to function as speaker of the house not speaker of the republican party ,22000118.0,22000118,<br/>,comment,1491013084.0,1,False,0.0,nan,22000118,https://graphics8.nytimes.com/images/apps/timespeople/none.png,478.0,nan,4.0,nan,0,approved,1.0,1.0,1491013148,mancuroc,12582762,rochester,nan,nan,0,58def3237c459f24986d7c84,unknown,oped,823.0,23,oped
1491011603,donald trump is the human equivalent of a black hole that consumes light and distorts space time and reality even planets and large stars will be drawn into his maw and consumed,21999837.0,21999837,<br/>,comment,1491010742.0,1,False,0.0,nan,21999837,https://s3.amazonaws.com/pimage.timespeople.nytimes.com/6217/9826/cropped-62179826.jpg,810.0,nan,5.0,nan,0,approved,1.0,0.0,1491011603,samme chittum,62179826,90065,nan,nan,0,58def3237c459f24986d7c84,unknown,oped,823.0,23,oped
1491011603,sean spicer is in an unenviable position yes but he put himself there  no one made him become trumps mouthpiece  no one with any integrity would have stated as spicer did on friday that president obama did very very bad things to trump  not only is that baseless it contradicts nunes claim of incidental eavesdroppingbrspicer deserves no sympathy for being part of something reprehensible ,21999790.0,21999790,<br/>,comment,1491010075.0,1,False,0.0,nan,21999790,https://graphics8.nytimes.com/images/apps/timespeople/none.png,1854.0,nan,16.0,nan,0,approved,1.0,0.0,1491011603,nm,40118532,ny,nan,nan,0,58def3237c459f24986d7c84,unknown,oped,823.0,23,oped
1491011603,i would laugh but theres nothing funny about this presidency even though it is a sick joke  it just needs to end,21999787.0,21999787,<br/>,comment,1491010062.0,1,False,0.0,nan,21999787,https://graphics8.nytimes.com/images/apps/timespeople/none.png,973.0,nan,1.0,nan,0,approved,1.0,0.0,1491011603,blue moon,73241821,where nenes fly,nan,nan,0,58def3237c459f24986d7c84,unknown,oped,823.0,23,oped
1491011603,dont credit trump with sean spicers transformation into a fifthgrader protesting that the dog ate his homework every day like clockwork  he was the same obnoxious obfuscator when he was spokesperson for the rnc long before trump was the nominee  ,21999721.0,21999721,<br/>,comment,1491009435.0,1,False,0.0,nan,21999721,https://graphics8.nytimes.com/images/apps/timespeople/none.png,541.0,nan,3.0,nan,0,approved,1.0,0.0,1491011603,mcv207,2108947,san francisco,nan,nan,0,58def3237c459f24986d7c84,unknown,oped,823.0,23,oped
1491011602,when signing the presidential proclamations in the oval office we always see a bunch of guys standing around himself  at first i thought it was to make sure he remembered to cross his t and not to write king before his name  brbrbut as things progress or regress they may all be lining up for presidential pardons just in case the truth ever comes out  please sign mine next,21999857.0,21999857,<br/>,comment,1491011010.0,1,False,0.0,nan,21999857,http://graphics8.nytimes.com/images/apps/timespeople/none.png,263.0,nan,0.0,nan,0,approved,1.0,0.0,1491011602,gordon,43099153,michigan,nan,nan,0,58def3237c459f24986d7c84,unknown,oped,823.0,23,oped
1491011602,ms collins you have included only the willing participants in the trump curse all the people you cite aided and abetted this disastrous presidency its the majority of ordinary americans who are feeling the curse of donald trump,21999804.0,21999804,<br/>,comment,1491010179.0,1,False,0.0,nan,21999804,https://graphics8.nytimes.com/images/apps/timespeople/none.png,433.0,nan,0.0,nan,0,approved,1.0,0.0,1491011602,doris2001,66560570,fairfax va,nan,nan,0,58def3237c459f24986d7c84,unknown,oped,823.0,23,oped
1491011602,i love this so muchbrbrnext time include republican reps who refused to listen to constituents about devoss,21999724.0,21999724,<br/>,comment,1491009447.0,1,False,0.0,nan,21999724,https://graphics8.nytimes.com/images/apps/timespeople/none.png,0.0,nan,0.0,nan,0,approved,1.0,0.0,1491011634,katherine,79131339,texas,nan,nan,0,58def3237c459f24986d7c84,unknown,oped,823.0,23,oped
1491011601,excellent work gail and now trump is doing the same thing to the entire us of a,21999874.0,21999874,<br/>,comment,1491011234.0,1,False,0.0,nan,21999874,https://graphics8.nytimes.com/images/apps/timespeople/none.png,101.0,nan,0.0,nan,0,approved,1.0,0.0,1491011601,ned stark,76789222,westeros,nan,nan,0,58def3237c459f24986d7c84,unknown,oped,823.0,23,oped
1491011601,i love your humor gailbrbrabsolutely love it also it occurs to me that melania may be playing a long game here,21999862.0,21999862,<br/>,comment,1491011069.0,1,False,0.0,nan,21999862,https://graphics8.nytimes.com/images/apps/timespeople/none.png,188.0,nan,2.0,nan,0,approved,1.0,0.0,1491011601,scrim1,59120993,bowie maryland,nan,nan,0,58def3237c459f24986d7c84,unknown,oped,823.0,23,oped
1491011601,what do the names listed including coal executives pretending to be coal miners have in common they are all the lowest common denominator of the greed equation,21999845.0,21999845,nan,comment,1491010847.0,1,False,0.0,nan,21999845,https://s3.amazonaws.com/pimage.timespeople.nytimes.com/6528/8079/cropped-65288079.jpg?0.4314634727779776,212.0,nan,2.0,nan,1,approved,1.0,0.0,1491011601,mkkw,65288079,baltimore,nan,nan,0,58def3237c459f24986d7c84,unknown,oped,823.0,23,oped
1491011601,the coal miners who included mine owners all of whom have jobs were there but the real folks who actually believed lyin don poor souls still dont see it do theybrhow ironic that we elites want to provide them health care a clean environment and the prospect of a job that doesnt give them black lung by paying more taxes even remain the villains it will not give us any satisfaction to be forced to watch their misery increase under this fatuous fraud,21999792.0,21999792,<br/>,comment,1491010088.0,1,False,0.0,nan,21999792,https://graphics8.nytimes.com/images/apps/timespeople/none.png,0.0,nan,0.0,nan,0,approved,1.0,0.0,1491011635,present,31709759,texas,nan,nan,0,58def3237c459f24986d7c84,unknown,oped,823.0,23,oped
1491011601,mom always said youre known by the company you keep i dont think she was thinking of trump inc as an exemplar,21999784.0,21999784,<br/>,comment,1491010029.0,1,False,0.0,nan,21999784,https://graphics8.nytimes.com/images/apps/timespeople/none.png,82.0,nan,0.0,nan,0,approved,1.0,0.0,1491011601,forrestfromtrees,78498793,ny,nan,nan,0,58def3237c459f24986d7c84,unknown,oped,823.0,23,oped
1491011601,guessing i am that despite all the outcries about trumps election and subsequent 70 days so far in office the results have been the proverbial blessing in disguise for the nyts calumnists  oops should that be columnists  well maybe not ,21999782.0,21999782,<br/>,comment,1491010018.0,1,False,0.0,nan,21999782,https://graphics8.nytimes.com/images/apps/timespeople/none.png,13.0,nan,8.0,nan,0,approved,1.0,0.0,1491011601,pete in sa,16450199,san antonio tx,nan,nan,0,58def3237c459f24986d7c84,unknown,oped,823.0,23,oped
1491011601,had to giggle then cry what the heck were we thinking to elect this misfit rich but a misfit just the same,21999744.0,21999744,<br/>,comment,1491009667.0,1,False,0.0,nan,21999744,https://graphics8.nytimes.com/images/apps/timespeople/none.png,0.0,nan,0.0,nan,0,approved,1.0,0.0,1491011635,d mac c,60036660,kc mo,nan,nan,0,58def3237c459f24986d7c84,unknown,oped,823.0,23,oped
1491011601,poor sean spicer nothing i want a reporter to ask him how do you sleep at night uttering so many lies day after daybrbrand dont get me started on paul ryan many of us were infatuated with ayn rand when we were in junior high school  by college we had outgrown her it is called maturity when will paul ryan  the dump peoples intellectual  grow up,21999731.0,21999731,<br/>,comment,1491009484.0,1,False,0.0,nan,21999731,https://graphics8.nytimes.com/images/apps/timespeople/none.png,821.0,nan,8.0,nan,0,approved,1.0,0.0,1491011601,caveat emptor,43791549,new jersey,nan,nan,0,58def3237c459f24986d7c84,unknown,oped,823.0,23,oped
1491011601,you forgot kellyanne conway who will play the female henchman when the mel brooks screenplay is written,21999726.0,21999726,<br/>,comment,1491009449.0,1,False,0.0,nan,21999726,https://s3.amazonaws.com/pimage.timespeople.nytimes.com/5707/3901/cropped-57073901.jpg,0.0,nan,0.0,nan,0,approved,1.0,0.0,1491011635,little league dad,57073901,san mateo,nan,nan,0,58def3237c459f24986d7c84,unknown,oped,823.0,23,oped
