approveDate,commentBody,commentID,commentSequence,commentTitle,commentType,createDate,depth,editorsSelection,parentID,parentUserDisplayName,permID,picURL,recommendations,recommendedFlag,replyCount,reportAbuseFlag,sharing,status,timespeople,trusted,updateDate,userDisplayName,userID,userLocation,userTitle,userURL,inReplyTo,articleID,sectionName,newDesk,articleWordCount,printPage,typeOfMaterial
1491052885,most of americas oil rich allies are the antithesis of liberal secular plural egalitarian democracies mexico canada and iraq are the lone exceptions  saudi arabia oman qatar bahrain uae nigeria and brazil lead the list of human rights misery venezuela is no better nor worse than any of them brbroil is worth more to america than any human rights concerns with 25 of the planets prisoners america is in no position of clean hands high moral authority to judge or condemn another nations governing human democratic violations,22002074.0,22002074,<br/>,comment,1491045471.0,1,False,0.0,nan,22002074,https://graphics8.nytimes.com/images/apps/timespeople/none.png,2.0,nan,1.0,nan,0,approved,1.0,0.0,1491052885,blackmamba,17374907,il,nan,nan,0,58def9f57c459f24986d7c90,unknown,editorial,575.0,22,editorial
1491052854,this is the best news president drumpf has heard since january 20 now thats what he wants in a us supreme court a bunch of lackeys  uh wise originalists  to ax the congress in the neck then get rid of the old supreme court and appoint the new trump court of bannon kushners ivanka and jared spicer conway miller flynn page and pence to help him run the country just as he wants on the facade of the supreme court building he can install a yooge trump sign in gold maduro is his hero way to go donny,22001991.0,22001991,<br/>,comment,1491044564.0,1,False,0.0,nan,22001991,https://graphics8.nytimes.com/images/apps/timespeople/none.png,0.0,nan,0.0,nan,0,approved,1.0,0.0,1491052854,janet w,72156500,new york ny,nan,nan,0,58def9f57c459f24986d7c90,unknown,editorial,575.0,22,editorial
1491052850,this is hat happens when the uninformed elect megalomaniac maniacs into power el presidente chavez sowed the seals of dictatorship now an ignorant bus driver is taking them over a cliff send in the marines,22001982.0,22001982,<br/>,comment,1491044407.0,1,False,0.0,nan,22001982,https://s3.amazonaws.com/pimage.timespeople.nytimes.com/1831/2178/cropped-18312178.jpg?0.5884960233233869,5.0,nan,0.0,nan,0,approved,1.0,0.0,1491052850,harry b,18312178,michigan,nan,nan,0,58def9f57c459f24986d7c90,unknown,editorial,575.0,22,editorial
1491044394,as long as the us can continue to buy cheap accesible oil from venezuela the maduro regime will hang on to power  trump is not supporting the oas efforts to put pressure on maduro for fear that the spigot will be shut down  maduro would not last a week if the us were to  stop buying oil  venezuelans would hurt temporarily but this action would eventually bring about a change towards democracy and a new representative governmentbrhowever trump is too busy planning his wall and worrying about russian interference in us politics to pay any attention to venezuela  besides i wonder if he could even find venezuela on the map,22001751.0,22001751,<br/>,comment,1491040865.0,1,False,0.0,nan,22001751,https://graphics8.nytimes.com/images/apps/timespeople/none.png,36.0,nan,6.0,nan,0,approved,1.0,0.0,1491416778,ipm,34165942,dc,nan,nan,0,58def9f57c459f24986d7c90,unknown,editorial,575.0,22,editorial
1491044394,a senseless political dispute will end in violencebrbrno venezuela is already one of the most violent countries in the hemisphere the government has been giving weapons including war weapons to civilians for years these gangs are organized now and they run the countrybrbrhunger is a daily for gangs chavistas and antichavistas the courts ruling was to institutionalize the dictatorship because maduro was not expecting the international response and the state drug cartel leadership got nervous luisa ortega went on tv in order to demonstrate to the world venezuelas respect for the separation of powers and reinstate the regimebrbrit is the same old story of democratically elected dictatorships i remind the world that yes venezuela elected chaves in 1998 for 5 years with no option to reelection venezuela did not elect the castronarco totalitarianismbrbri am sure that the famished population will go again and again to the streets including my 84year mother and my sister who received a kidnap threat last month some of those demonstrators will be killed and jailed againbrbrinternet and whatsapp will keep us connected until maduro and diosdado decide otherwisebrbra free election judicial due processes to the corrupt and narcogovernment leaders and the demilitarization of gangs are what most venezuelans that i know want i know lots of them,22001748.0,22001748,<br/>,comment,1491040825.0,1,False,0.0,nan,22001748,https://s3.amazonaws.com/pimage.timespeople.nytimes.com/3060/7067/cropped-30607067.jpg?0.8467663380294262,45.0,nan,5.0,nan,1,approved,1.0,0.0,1491044394,aurace rengifo,30607067,miami beach,nan,nan,0,58def9f57c459f24986d7c90,unknown,editorial,575.0,22,editorial
1491044393,just send sean penn down for a weekend and everything should be fine,22001836.0,22001836,<br/>,comment,1491042576.0,1,False,0.0,nan,22001836,https://graphics8.nytimes.com/images/apps/timespeople/none.png,16.0,nan,2.0,nan,0,approved,1.0,0.0,1491044393,kevin thomas,67022347,nj,nan,nan,0,58def9f57c459f24986d7c90,unknown,editorial,575.0,22,editorial
1491044393,its very sad to see some diehard leftists defend this socialist dictatorship that is descending into the same black hole of history as the ussr maos china and cambodia  the regimes that killed many more people than nazi germany it is almost equally sad to see some newly emboldened rightwingers drag obama into a situation that has nothing to do with him obama was not a socialist and america  thankfully  has no strong socialist movement trumps populism on the other hand does have some unsettling resemblances to what used to be called brown socialism  or fascism,22001800.0,22001800,<br/>,comment,1491041971.0,1,False,0.0,nan,22001800,https://s3.amazonaws.com/pimage.timespeople.nytimes.com/6506/7919/cropped-65067919.jpg?0.6406161307822913,0.0,nan,0.0,nan,0,approved,1.0,0.0,1491044423,mor,65067919,california,nan,nan,0,58def9f57c459f24986d7c90,unknown,editorial,575.0,22,editorial
1491044393,chavez emphasized the importance of the venezuelan constitution which was an early product of his legitimate election to the presidency  he followed the constitution which mandated the use of referendum and wonbrlater he lost another referendum to change the constitution which the people would not permit  with his early dominance of the assembly using their passage of los leyes habilitantes or laws empowering him he ended up changing the constitution in his favor anyway  so began the erosion of power in the hands of the people  now they are almost powerlessbrbut still chavez kept everything going downhill devouring petroleum profits without diversification and nationalizing businesses without considering the longterm cost consequences to the nationbrits easy to understand the nationalization of petroleum nearly every country has done this except the us but the nationalization of the cement industry every nationalization shrugged off more costs onto the back of the government which is now basically bankruptbrit is now just another corrupt military junto grabbing everything thats not nailed down,22001713.0,22001713,<br/>,comment,1491040101.0,1,False,0.0,nan,22001713,https://graphics8.nytimes.com/images/apps/timespeople/none.png,8.0,nan,0.0,nan,0,approved,1.0,0.0,1491044393,bruce,32411948,ms,nan,nan,0,58def9f57c459f24986d7c90,unknown,editorial,575.0,22,editorial
1491044393,is it conceivable to the new york times that at times autocratic rule is the only way to restore law and order and financial stability to a countrybrbrever since the end of world war ii the unites states has been trying to export democratic concepts to the third world the successes have been few and even those have been far more apparent than real sham governments at best and controlled behindthescenes by international financial interests,22001637.0,22001637,<br/>,comment,1491038107.0,1,False,0.0,nan,22001637,https://graphics8.nytimes.com/images/apps/timespeople/none.png,6.0,nan,3.0,nan,0,approved,1.0,0.0,1491044393,steve,65431352,paia,nan,nan,0,58def9f57c459f24986d7c90,unknown,editorial,575.0,22,editorial
1491044392,terrible i wonder why venezuelans dont get rid of him nobody else is going to do it for them,22001838.0,22001838,<br/>,comment,1491042619.0,1,False,0.0,nan,22001838,https://graphics8.nytimes.com/images/apps/timespeople/none.png,7.0,nan,1.0,nan,0,approved,1.0,0.0,1491044392,david,21282535,mexico city,nan,nan,0,58def9f57c459f24986d7c90,unknown,editorial,575.0,22,editorial
1491044391,and turkey dictatorships are only possible by a fractured governments first trash the press as untruthful then trash the legal stysem then appoint your loyal buddies to important positions then gut the functioning government agencies one little step at a time then one looks around at the newly elected goverment and do nothing usually because they dont recognise whats happening til its too latebrhumm ,22001894.0,22001894,<br/>,comment,1491043482.0,1,False,0.0,nan,22001894,https://graphics8.nytimes.com/images/apps/timespeople/none.png,38.0,nan,2.0,nan,0,approved,1.0,0.0,1491044391,carol,54569562,seattle,nan,nan,0,58def9f57c459f24986d7c90,unknown,editorial,575.0,22,editorial
1491044347,it has always been a dictatorship except it is getting naked by as corruption has become to apparent and the manipulation of the masses no longer worksbrbrthis is a warning lesson for people here in the us trump is using the chavez playbook already dhs doj and ice have become the paramilitary private army while some of the masses still believe in trumps populist agenda already disproved by his appointments outright nepotism and initiatives like the ahca once the mass madness fever breaks and coal miners are still unemployed because natural gas is cheap and aplenty it will follow the footstep of venezuela ,22001970.0,22001970,<br/>,comment,1491044291.0,1,False,0.0,nan,22001970,https://s3.amazonaws.com/pimage.timespeople.nytimes.com/7221/086/cropped-7221086.jpg?0.9674960863776505,14.0,nan,0.0,nan,0,approved,1.0,1.0,1491044347,bos,7221086,boston,nan,nan,0,58def9f57c459f24986d7c90,unknown,editorial,575.0,22,editorial
1491038203,now theres a problem with venezuela  what about when chavez was sucking up to obamas favorites the castro brothers  i guess obamas rapprochement with cuba didnt include any discussion about their aid to venezuela,22000372.0,22000372,<br/>,comment,1491015131.0,1,False,0.0,nan,22000372,https://graphics8.nytimes.com/images/apps/timespeople/none.png,12.0,nan,1.0,nan,0,approved,1.0,0.0,1491038203,larry,22896385,ny,nan,nan,0,58def9f57c459f24986d7c90,unknown,editorial,575.0,22,editorial
1491038201,the most frightening moment for me was when mitch mcconnell announced he was going to ignore the constitution and not allow obama to appoint a supreme court justice  it was scary because it made me realize how fragile our constitution isbrwe are sure that it could not happen here but it could,22001631.0,22001631,<br/>,comment,1491037985.0,1,False,0.0,nan,22001631,https://graphics8.nytimes.com/images/apps/timespeople/none.png,132.0,nan,2.0,nan,0,approved,1.0,0.0,1491038201,sally,60025847,nyc,nan,nan,0,58def9f57c459f24986d7c90,unknown,editorial,575.0,22,editorial
1491038200,how about asking why the majority of venezuelans voted in chavez to begin with be honest new york timesbrits because preceding governments did nothing for the poor majority although all may be suffering now nothing will be done to help the poor once the old guard gets back in powerbrmaybe a change in attitude toward the poor majority  is needed on the part of smaller middle and upper classes of the country,22001148.0,22001148,<br/>,comment,1491024337.0,1,False,0.0,nan,22001148,https://s3.amazonaws.com/pimage.timespeople.nytimes.com/1927/63/cropped-192763.jpg?1065157101668578623,11.0,nan,1.0,nan,0,approved,1.0,0.0,1491038200,kaari,192763,madison wi,nan,nan,0,58def9f57c459f24986d7c90,unknown,editorial,575.0,22,editorial
1491038200,send salons david sirota down to help maduro out he wrote that venezuela had racked up an economic record that american presidents could only dream of achieving ,22000017.0,22000017,<br/>,comment,1491012453.0,1,False,0.0,nan,22000017,https://s3.amazonaws.com/pimage.timespeople.nytimes.com/1051/26/cropped-105126.jpg?1420012750737530436,20.0,nan,0.0,nan,1,approved,1.0,0.0,1491038200,gary misch,105126,syria virginia,nan,nan,0,58def9f57c459f24986d7c90,unknown,editorial,575.0,22,editorial
1491038198,please dont drink  the mainstream establishments koolaid on venezuelabrremember the us government is an imperialist nation and is constantly looking to control the resources and wealth of other countries venezuela could well be another source of cheap oilbrbraccording to the cia factbook chavez accomplished much for his people and the us just like they did with cuba decided his success threatened to spread socialism to the rest of the sa continentbrbra hrefhttpswwwciagovlibrarypublicationstheworldfactbookgeosvehtml titlehttpswwwciagovlibrarypublicationstheworldfactbookgeosvehtml target_blankhttpswwwciagovlibrarypublicationstheworldfactbookgeosvehtmlabrbrand from the council of hemispheric affairs the chvez and maduro governments have attempted to transition venezuela away from a society that has been not only inherently racist and classist but also highly rigid stratified and oligarchic problems inevitably arise because this elite already holds the reins and can aggressively resist a recalibration of economic and social powerbrbra hrefhttpwwwcohaorgtheotherexplanationforvenezuelaseconomiccrisis2 titlehttpwwwcohaorgtheotherexplanationforvenezuelaseconomiccrisis2 target_blankhttpwwwcohaorgtheotherexplanationforvenezuelaseconomiccrisis2a,22001171.0,22001171,<br/>,comment,1491024710.0,1,False,0.0,nan,22001171,https://graphics8.nytimes.com/images/apps/timespeople/none.png,11.0,nan,3.0,nan,1,approved,1.0,0.0,1491038198,sea star rn,62356059,san francisco,nan,nan,0,58def9f57c459f24986d7c90,unknown,editorial,575.0,22,editorial
1491038128,president nicols maduro won get over it,22001131.0,22001131,<br/>,comment,1491023960.0,1,True,0.0,nan,22001131,https://graphics8.nytimes.com/images/apps/timespeople/none.png,23.0,nan,4.0,nan,0,approved,1.0,0.0,1491416784,fran soyer,57179778,ny,nan,nan,0,58def9f57c459f24986d7c90,unknown,editorial,575.0,22,editorial
1491037986,once constitutional order slips under the autocratic control rendering in turn the constitutionally delineated authority spheres of governance superfluous the only corrective left is the popular protest voice similar to what could be seen in the street protests during last year when the economic and political crisis was building up in venezuela ,22001628.0,22001628,<br/>,comment,1491037930.0,1,False,0.0,nan,22001628,https://s3.amazonaws.com/pimage.timespeople.nytimes.com/5774/2567/cropped-57742567.jpg?0.4877129049242759,6.0,nan,0.0,nan,0,approved,1.0,1.0,1491037986,profjai prakash sharma,57742567,jaipur india,nan,nan,0,58def9f57c459f24986d7c90,unknown,editorial,575.0,22,editorial
1491037953,maduro and trumpgopbr1 tell big lies to distract and deflect blamebr2 allege there are sinister conspiracies impeding your greatnessbr3 attack the pressbr4 always deny accountability for failure blame the oppositionbr5 accuse opponents of being criminals lock them upbr5 stack the courts refuse to vote on legally nominated opponent candidatesbr6 defund the health care system with graft or tax cuts for the powerful,22001115.0,22001115,<br/>,comment,1491023684.0,1,False,0.0,nan,22001115,https://graphics8.nytimes.com/images/apps/timespeople/none.png,0.0,nan,0.0,nan,0,approved,1.0,0.0,1491037983,ac,6967505,usa,nan,nan,0,58def9f57c459f24986d7c90,unknown,editorial,575.0,22,editorial
1491037953,venezeula has been an outright dictatorshp since shortly after hugo chavez took power in 1999brbrhis tolerance of a democratic legislature was proporpotional to the number of his hacks and quislings he could seed through government by volence vote rigging and outright thuggerybrbris the esteemed editorial board just mow twigging to the nature of venezuelas terrible record of having the interests of the peoplebrbrperhaps you folks move beyond starbucks and zabars,22000329.0,22000329,<br/>,comment,1491014860.0,1,False,0.0,nan,22000329,https://graphics8.nytimes.com/images/apps/timespeople/none.png,19.0,nan,1.0,nan,0,approved,1.0,0.0,1491037953,the owl,57702801,new england,nan,nan,0,58def9f57c459f24986d7c90,unknown,editorial,575.0,22,editorial
1491037953,i wonder if the nyt editorial staff has spent even one second considering the similarity between the antics of the hugo chaveznicolas maduro regime and what chilean president salvador allende attempted to do to chile if one reads history instead of the nyt one cannot escape the conclusion that maduro is allendes alter ego only maduro has the courts police and army firmly on his side contrary to the orwellian musings of peter kornbluh christopher hitchens and the nyts ariel dorfman allende tried to follow more or less the script now being acted out in venezuelabrbrallende drove publishing house zigzag out of business in 1971 by forcing it to raise wages 65 percent and denying it business loans encouraged violent land seizures which led to food shortages severe enough to require rationing allowed extralegal tribunals to be set up in tenements headed by people with no legal training engaged in massive vote fraud during the 1973 congressional elections merely reshuffled his cabinet when the chilean congress removed one of his ministers from office eg interior minister jose toha was reappointed defense minister the day after he was suspended by congress in january 1972 paid for increased government salaries by printing money eventually causing inflation to rise to 300 percent per year etc etcbrbrfor over forty years american leftists have glossed over the actual events that occurred in chile during the allende years maduro is allendes ideological heir,21999921.0,21999921,<br/>,comment,1491011638.0,1,False,0.0,nan,21999921,https://graphics8.nytimes.com/images/apps/timespeople/none.png,11.0,nan,6.0,nan,0,approved,1.0,0.0,1491037953,publicitus,67661019,california,nan,nan,0,58def9f57c459f24986d7c90,unknown,editorial,575.0,22,editorial
1491037950,in the us judicial usurpation via judicial review to undo some laws rewrite the const when laws dont exist from the legislature that the judiciary wants and  extensive use of judicial oversight and positive injunctions to impose a platonic philosopher king rule by elitesbrbrall show us that venezuela is merely uslitebrbrat least they are honest about itbr,22001527.0,22001527,<br/>,comment,1491034104.0,1,False,0.0,nan,22001527,https://graphics8.nytimes.com/images/apps/timespeople/none.png,2.0,nan,0.0,nan,0,approved,1.0,0.0,1491037950,fortress america,3985142,nyc,nan,nan,0,58def9f57c459f24986d7c90,unknown,editorial,575.0,22,editorial
1491037950,every time a regime comes to power and calls itself socialist the immediate response from the absurd political left exemplary is code pink embraces it then after sending legions of lefty advocates on reality tours to see first hand their would be ideal marxist society the reality of dictatorship sets in and the left becomes silentbrone could ask when leftists will acknowledge that socialism doesnt work but we already know the answer never,22001180.0,22001180,<br/>,comment,1491024926.0,1,False,0.0,nan,22001180,https://graphics8.nytimes.com/images/apps/timespeople/none.png,18.0,nan,1.0,nan,0,approved,1.0,0.0,1491037950,danguide,35726186,berkeley ca,nan,nan,0,58def9f57c459f24986d7c90,unknown,editorial,575.0,22,editorial
1491037950,this is one of the most important global events this week and at least online front page the times has barely covered it why is it major events in the americas always seem to be backpage news,22001060.0,22001060,<br/>,comment,1491022872.0,1,False,0.0,nan,22001060,https://graphics8.nytimes.com/images/apps/timespeople/none.png,0.0,nan,0.0,nan,0,approved,1.0,0.0,1491037981,arlen neimeyer,46832380,vancouver,nan,nan,0,58def9f57c459f24986d7c90,unknown,editorial,575.0,22,editorial
1491037950,welcome back o the bad days of dictatorships in south america at least this time it wasnt caused by actions of the republicans,22000261.0,22000261,<br/>,comment,1491014268.0,1,False,0.0,nan,22000261,https://graphics8.nytimes.com/images/apps/timespeople/none.png,2.0,nan,0.0,nan,0,approved,1.0,0.0,1491037950,paul,60834232,earth,nan,nan,0,58def9f57c459f24986d7c90,unknown,editorial,575.0,22,editorial
1491037950,i cringe when i see an editorial preaching a sermon about another countrybrit is a venezulean problem let them solve it themselvesbrreport the news wthoutmbias but dont preachbrnot your business nor mine,22000130.0,22000130,<br/>,comment,1491013182.0,1,False,0.0,nan,22000130,https://graphics8.nytimes.com/images/apps/timespeople/none.png,4.0,nan,0.0,nan,0,approved,1.0,0.0,1491037950,waldo,69620519,canada,nan,nan,0,58def9f57c459f24986d7c90,unknown,editorial,575.0,22,editorial
1491037949,the precedents for oas action are good and bad the oas sanctions which drove castros cuba from the oas braked his first efforts to promote soviet backed revolutions elsewhere in the western hemisphere but they did not as some american officials expected drive him from office  by the early 1970s most of latin america opposed their continuance which led henry kissinger to agree to have members of the oas decide for themselves our sanctions as readers know continued until near the end of the obama administration brbrthe 1960 ouster from the oas of the trujillo regime marked the beginning of the end for the dominican dictator who massacred haitians killed dominican opponents and raped young girls trujillo was assassinated with reason by dominican opponents   im not recommending that fate for maduro but for venezuelans to oust him will retire latin american neighbors to put enough pressure including ostracism by the oas on the ruling class to get it to end the dictatorship and hold honest elections  brbrif not numbers of venezuelans will die unnecessarily,22001157.0,22001157,<br/>,comment,1491024400.0,1,False,0.0,nan,22001157,https://graphics8.nytimes.com/images/apps/timespeople/none.png,1.0,nan,0.0,nan,1,approved,1.0,0.0,1491037949,frank mcneil,53422502,boca raton florida,nan,nan,0,58def9f57c459f24986d7c90,unknown,editorial,575.0,22,editorial
1491037949,how surprising that someone might see  madoro as a warning against trump after eight years of obama support for latin american socialism and selective enforcing out own laws we should be breathing a sigh of relief that our former tin pot  dictator is on the golf course and not running up the entitlement state,22000918.0,22000918,<br/>,comment,1491020608.0,1,False,0.0,nan,22000918,https://graphics8.nytimes.com/images/apps/timespeople/none.png,8.0,nan,2.0,nan,0,approved,1.0,0.0,1491037949,georgeb purdell,65398410,atlanta ga,nan,nan,0,58def9f57c459f24986d7c90,unknown,editorial,575.0,22,editorial
1491037949,despicablebrbrselfcorrection,22000080.0,22000080,<br/>,comment,1491012831.0,1,False,0.0,nan,22000080,https://graphics8.nytimes.com/images/apps/timespeople/none.png,1.0,nan,0.0,nan,0,approved,1.0,0.0,1491037949,d,67438217,ct,nan,nan,0,58def9f57c459f24986d7c90,unknown,editorial,575.0,22,editorial
1491037948,yet another situation that illustrates the utility of intelligent intervention when necessary  a laissez faire policy of doing nothing enables and normalizes trends that can ultimately be our undoing being a good neighbor works on many levels we might want to consider starting with venezuela,22001001.0,22001001,<br/>,comment,1491021657.0,1,False,0.0,nan,22001001,https://graphics8.nytimes.com/images/apps/timespeople/none.png,1.0,nan,0.0,nan,0,approved,1.0,0.0,1491037948,rjw,55170561,chicago,nan,nan,0,58def9f57c459f24986d7c90,unknown,editorial,575.0,22,editorial
1491037948,great legacy of chavez,22000279.0,22000279,<br/>,comment,1491014456.0,1,False,0.0,nan,22000279,https://graphics8.nytimes.com/images/apps/timespeople/none.png,0.0,nan,0.0,nan,0,approved,1.0,0.0,1491037979,david price,62789422,tokyo,nan,nan,0,58def9f57c459f24986d7c90,unknown,editorial,575.0,22,editorial
1491037948,caesar had his brutus charles the first his cromwell and nicolas maduro  may profit from their example if this be treason let us make the most of itbrpatrick henry 1765 1775brbrperhaps not only a warning to despots but also a ray of hope to those oppressed and victimized by such cowards and criminals who misrobed and misplaced into positions of authority and power which they subsequently abuse destroy all that is good in order to satiate their own dispicable and sadistic lust for power they always leave a wake of death and destruction  of innocent people brbrthere are no good consequences from dictators they should be obliterated from this earth with an emphasis ,22000028.0,22000028,<br/>,comment,1491012518.0,1,False,0.0,nan,22000028,https://graphics8.nytimes.com/images/apps/timespeople/none.png,1.0,nan,0.0,nan,0,approved,1.0,0.0,1491037948,d,67438217,ct,nan,nan,0,58def9f57c459f24986d7c90,unknown,editorial,575.0,22,editorial
