approveDate,commentBody,commentID,commentSequence,commentTitle,commentType,createDate,depth,editorsSelection,parentID,parentUserDisplayName,permID,picURL,recommendations,recommendedFlag,replyCount,reportAbuseFlag,sharing,status,timespeople,trusted,updateDate,userDisplayName,userID,userLocation,userTitle,userURL,inReplyTo,articleID,sectionName,newDesk,articleWordCount,printPage,typeOfMaterial
1491245186,this project makes me happy to be a 30 year times subscriber continue to innovate across all platforms please,22022598.0,22022598,<br/>,comment,1491237056.0,1,False,0.0,nan,22022598,https://graphics8.nytimes.com/images/apps/timespeople/none.png,2.0,nan,0.0,nan,0,approved,1.0,0.0,1491245186,rob gayle,46006296,riverside ca,nan,nan,0,58def1347c459f24986d7c80,unknown,insider,716.0,2,news
1491188619,stunning photos and reportage infuriating that the trump admistrations draconian reinstatement of the global gag order will prevent men and women from receiving appropriate family planning advice so obviously desperately   needed,22017350.0,22017350,nan,comment,1491180489.0,1,False,0.0,nan,22017350,https://graphics8.nytimes.com/images/apps/timespeople/none.png,1.0,nan,0.0,nan,0,approved,1.0,0.0,1491188619,susan a,29202761,br,nan,nan,0,58def1347c459f24986d7c80,unknown,insider,716.0,2,news
1491188617,brilliant work from conception to execution ive never seen anything like it  as a paper of record it is important to leave a record of these and other peoples for whom no one else speaks  please keep humanizing what are otherwise bland statistics  it matters time and again their stories sounded like mine could have been mine  were about to see hordes of people far away experiencing utter devastation  empathy goes away unless there are names and stories and pictures  links to helping at organizations resources  ,22017334.0,22017334,<br/>,comment,1491179470.0,1,False,0.0,nan,22017334,https://graphics8.nytimes.com/images/apps/timespeople/none.png,3.0,nan,0.0,nan,0,approved,1.0,0.0,1491188617,meta,63944806,raleigh nc,nan,nan,0,58def1347c459f24986d7c80,unknown,insider,716.0,2,news
1491167820,nyt reporters should provide a contributors link to a crowdfunding project or aid organization focused on the specific subject of news stories like this not for every sad story but for the biggest and most obvious human problems on earth brbrthat should be a regular feature with a dedicated clickbutton always located in the same familiar spot only 36 of america has truly hardened their hearts toward those suffering abroad ,22015913.0,22015913,<br/>,comment,1491150196.0,1,False,0.0,nan,22015913,https://graphics8.nytimes.com/images/apps/timespeople/none.png,7.0,nan,2.0,nan,0,approved,1.0,0.0,1491167820,tom wyrick,1266184,missouri usa,nan,nan,0,58def1347c459f24986d7c80,unknown,insider,716.0,2,news
1491167815,could only have been done in print stunning ,22015466.0,22015466,<br/>,comment,1491147284.0,1,False,0.0,nan,22015466,http://profile.ak.fbcdn.net/hprofile-ak-snc4/hs439.snc4/48586_720248669_1867_q.jpg,5.0,nan,0.0,nan,0,approved,1.0,0.0,1491167815,joe sharkey,61121360,tucson arizona,nan,nan,0,58def1347c459f24986d7c80,unknown,insider,716.0,2,news
1491142576,thank you new york times people should be supporting and encouraging live theater which brings these photos to life cab dramatists write about real issuesbrmoney to arts not guns,22012085.0,22012085,<br/>,comment,1491128692.0,1,False,0.0,nan,22012085,https://graphics8.nytimes.com/images/apps/timespeople/none.png,8.0,nan,0.0,nan,0,approved,1.0,0.0,1491142576,dramaman,59125002,new york,nan,nan,0,58def1347c459f24986d7c80,unknown,insider,716.0,2,news
1491060909,proof that photojournalism is alive and well excellent work mr ferguson,22003784.0,22003784,<br/>,comment,1491056012.0,1,False,0.0,nan,22003784,https://graphics8.nytimes.com/images/apps/timespeople/none.png,9.0,nan,0.0,nan,0,approved,1.0,0.0,1491060909,bob williams,320791,east northport ny,nan,nan,0,58def1347c459f24986d7c80,unknown,insider,716.0,2,news
1491252241,the oasis initiative which i started with prof malcolm potts at uc berkeley is focusing on building local leadership and the evidence base necessary to help people in the sahel face africas greatest development challenge unprecedented population growth and effects of climate change in an already fragile region please consider supporting our work  the donate button is on the top right gifts to uc berkeley have only about 3 indirect cost rate a hrefhttpwwwoasisinitiativeberkeleyedu titlewwwoasisinitiativeberkeleyedu target_blankwwwoasisinitiativeberkeleyedua ,22024897.0,22024897,<br/>,userreply,1491247899.0,2,False,22015913.0,tom wyrick,22015913:22024897,https://graphics8.nytimes.com/images/apps/timespeople/none.png,1.0,nan,0.0,nan,0,approved,1.0,0.0,1491252241,alisha g,65289571,tahoma ca,nan,nan,22015913,58def1347c459f24986d7c80,unknown,insider,716.0,2,news
1491668599,i agree ive just spent 30 minutes trying to find a place to donate money that will actually go to these people,22082978.0,22082978,nan,userreply,1491665056.0,2,False,22015913.0,tom wyrick,22015913:22082978,https://graphics8.nytimes.com/images/apps/timespeople/none.png,0.0,nan,0.0,nan,0,approved,1.0,0.0,1491668599,kathy mortensen,76442479,ann arbor,nan,nan,22015913,58def1347c459f24986d7c80,unknown,insider,716.0,2,news
1491064414,how about katrina pierson back to palookaville for her,22004930.0,22004930,<br/>,comment,1491061051.0,1,False,0.0,nan,22004930,https://graphics8.nytimes.com/images/apps/timespeople/none.png,60.0,nan,0.0,nan,0,approved,1.0,0.0,1491064414,gaucho54,59237391,california,nan,nan,0,58def3237c459f24986d7c84,unknown,oped,823.0,23,oped
1491064399,you can fool some of the people all of the time brbrtherein lies djts political base day by day that base that pool continues to shrink in number  its just another way of draining the swamp keep working on that pool djt  keep working on that pool you can eliminate that swamp trust me  im an expired notarybrbrnobody does it better than you youre the greatest djt just keep on keeping on youve got your stuff working,22005135.0,22005135,<br/>,comment,1491061867.0,1,False,0.0,nan,22005135,https://s3.amazonaws.com/pimage.timespeople.nytimes.com/5574/7814/cropped-55747814.jpg?0.48171199136413634,96.0,nan,0.0,nan,1,approved,1.0,0.0,1491064399,agent 86,55747814,oxford mississippi,nan,nan,0,58def3237c459f24986d7c84,unknown,oped,823.0,23,oped
1491064392,the dreaded trump curseyou mean theres only one,22004841.0,22004841,<br/>,comment,1491060736.0,1,False,0.0,nan,22004841,https://graphics8.nytimes.com/images/apps/timespeople/none.png,61.0,nan,0.0,nan,0,approved,1.0,0.0,1491064392,n smith,64679318,new york city,nan,nan,0,58def3237c459f24986d7c84,unknown,oped,823.0,23,oped
1491064381,no one is stopping sean spicer or any of the others from quitting if they are so horrified by trumps policies and practices,22005149.0,22005149,<br/>,comment,1491061913.0,1,False,0.0,nan,22005149,https://graphics8.nytimes.com/images/apps/timespeople/none.png,154.0,nan,0.0,nan,0,approved,1.0,0.0,1491064381,cordelia28,8542342,astoria or,nan,nan,0,58def3237c459f24986d7c84,unknown,oped,823.0,23,oped
1491064377,oh my god poor sean spicer you wouldnt wish this on anyonebrexcept sean in fact they all deserve it,22004746.0,22004746,<br/>,comment,1491060401.0,1,False,0.0,nan,22004746,http://graphics8.nytimes.com/images/apps/timespeople/none.png,178.0,nan,0.0,nan,0,approved,1.0,0.0,1491064377,c morris,29602765,idaho,nan,nan,0,58def3237c459f24986d7c84,unknown,oped,823.0,23,oped
1491064358,oh my god poor sean spicer you wouldnt wish this on anyonebrbryes yes you would,22005218.0,22005218,<br/>,comment,1491062203.0,1,False,0.0,nan,22005218,https://s3.amazonaws.com/pimage.timespeople.nytimes.com/1577/3758/cropped-15773758.jpg,134.0,nan,0.0,nan,1,approved,1.0,0.0,1491064358,michael,15773758,richmond va,nan,nan,0,58def3237c459f24986d7c84,unknown,oped,823.0,23,oped
1491064351,cant we just get sean spicer ms conway and all of trumps other regular tv defendershugh hewitt et albefore tv cameras for a daily 15 minute segment in which they all spout their deflections and misdirections without interruption why let reporters questions slow the flow of misinformation just let the deflectors spout it all out in a burst then we would not have to be plagued by their inanities throughout the daybrbrfifteen minutes should be plenty of time for fox news to get all the sound bites they need for any given daybrbrfifteen minutes should also be plenty of time for those who wish to be misinformed to receive all the disinformation they could possibly want,22005228.0,22005228,<br/>,comment,1491062243.0,1,False,0.0,nan,22005228,https://graphics8.nytimes.com/images/apps/timespeople/none.png,91.0,nan,0.0,nan,0,approved,1.0,0.0,1491064351,andrew g bjelland sr,58063917,salt lake city utah,nan,nan,0,58def3237c459f24986d7c84,unknown,oped,823.0,23,oped
1491064317,i keep waiting for spicer to show at his podium wearing a beanie with a propeller on top  i have to believe when he closes his eyes trying to sleep the inside of his brain is going like a pin ball machinebrit would all be great material for a never to believed spoof on washington if we werent watching our nation circling the porcelain conveniencebrcuriouser and curiouser,22004632.0,22004632,<br/>,comment,1491059984.0,1,False,0.0,nan,22004632,https://s3.amazonaws.com/pimage.timespeople.nytimes.com/4212/8569/cropped-42128569.jpg?1173591530237930251,134.0,nan,0.0,nan,0,approved,1.0,0.0,1491064317,bob laughlin,42128569,denver,nan,nan,0,58def3237c459f24986d7c84,unknown,oped,823.0,23,oped
1491064312,bravo gail bradd to your list of the pariahlike effect dt poses to  famous people  musicians stars artists athletes team owners none of whom apparently want an invite to anything associated with this wh one exception  bob kraft he was apparently needed at mara lago when the nuclear football was being tossed around in the wake of the call from no korea ,22004617.0,22004617,<br/>,comment,1491059913.0,1,False,0.0,nan,22004617,https://s3.amazonaws.com/pimage.timespeople.nytimes.com/6470/2728/cropped-64702728.jpg?0.9800722880447814,33.0,nan,0.0,nan,0,approved,1.0,0.0,1491064312,r mackinnon,64702728,concord ma,nan,nan,0,58def3237c459f24986d7c84,unknown,oped,823.0,23,oped
1491063880,what about poor kellyanne ,22004589.0,22004589,<br/>,comment,1491059795.0,1,False,0.0,nan,22004589,https://graphics8.nytimes.com/images/apps/timespeople/none.png,57.0,nan,0.0,nan,0,approved,1.0,0.0,1491063880,ken,6407662,the woodlands texas,nan,nan,0,58def3237c459f24986d7c84,unknown,oped,823.0,23,oped
1491063877,oh yeah gail we do wish this on everyone of these a holes  they deserve what they are getting as does don the con who hopefully is going to get ousted to siberia where he can ride off bareback with putin into the sunset on the back of a white horse,22004546.0,22004546,<br/>,comment,1491059587.0,1,False,0.0,nan,22004546,https://graphics8.nytimes.com/images/apps/timespeople/none.png,128.0,nan,0.0,nan,0,approved,1.0,0.0,1491063877,trueblue,22178100,ky,nan,nan,0,58def3237c459f24986d7c84,unknown,oped,823.0,23,oped
1491062756,gail collins funny columns alone are worth the price of a nyt subscription she gives me a good laugh every time i read her something i greatly appreciate during these anxious times many thanks to her,22004815.0,22004815,<br/>,comment,1491060630.0,1,False,0.0,nan,22004815,https://graphics8.nytimes.com/images/apps/timespeople/none.png,168.0,nan,0.0,nan,0,approved,1.0,0.0,1491062756,rlmullaney,61116551,memphis tn,nan,nan,0,58def3237c459f24986d7c84,unknown,oped,823.0,23,oped
1491062756,just as in every conflict before those who supported trump or invested with him lost their shirts while trump made another billion or sobras for mr spicer he is almost as funny as the kellyann character they are both highly creative in their ability to twist an originally truthful statement that is negative about trump into a laughable lie i say laughable but it is truly sick both come out appearing to not know the truth if they tripped over it ,22004629.0,22004629,<br/>,comment,1491059970.0,1,False,0.0,nan,22004629,https://graphics8.nytimes.com/images/apps/timespeople/none.png,111.0,nan,0.0,nan,0,approved,1.0,1.0,1491062756,jw,45764709,palo alto ca,nan,nan,0,58def3237c459f24986d7c84,unknown,oped,823.0,23,oped
1491062738,could it be that the reason russian representatives are talking about a new cold war much worse is to distract us from trumps worship of putinbrbrafter all they have great respect for the truth using it very sparingly,22005189.0,22005189,<br/>,comment,1491062069.0,1,False,0.0,nan,22005189,https://graphics8.nytimes.com/images/apps/timespeople/none.png,44.0,nan,0.0,nan,0,approved,1.0,0.0,1491062738,bruce maier,75684432,shoreham by,nan,nan,0,58def3237c459f24986d7c84,unknown,oped,823.0,23,oped
1491062738,who cares about his immediate family or how he pillages the reputations of friends and associates alike they signed on and will face the consequences we must resist their incursion at every turn for we the people of the this nation are its greatest asset and trump and company represent a threat to our futures and the futures of our families and friends,22005185.0,22005185,<br/>,comment,1491062057.0,1,False,0.0,nan,22005185,https://graphics8.nytimes.com/images/apps/timespeople/none.png,75.0,nan,0.0,nan,0,approved,1.0,0.0,1491062738,nc,37475757,evergreen,nan,nan,0,58def3237c459f24986d7c84,unknown,oped,823.0,23,oped
1491062737,as usual very insightful ms collins  to a person everyone on your list are hypocrites latching onto trumps coattails to further their own narrow agendasbrbri dont think i have detested a group of people more in my lifetime,22004932.0,22004932,<br/>,comment,1491061062.0,1,False,0.0,nan,22004932,https://s3.amazonaws.com/pimage.timespeople.nytimes.com/7711/3804/cropped-77113804.jpg,137.0,nan,0.0,nan,0,approved,1.0,0.0,1491062737,len,77113804,pennsylvania,nan,nan,0,58def3237c459f24986d7c84,unknown,oped,823.0,23,oped
1491062737,there is a word for these people collaborators,22004805.0,22004805,<br/>,comment,1491060603.0,1,False,0.0,nan,22004805,https://graphics8.nytimes.com/images/apps/timespeople/none.png,151.0,nan,0.0,nan,0,approved,1.0,0.0,1491062737,susan,76785549,massachusetts,nan,nan,0,58def3237c459f24986d7c84,unknown,oped,823.0,23,oped
1491062737,my husband is reading hr mcmasters dereliction of  of duty  how can mcmaster stay on as national security advisor when the staffers he tried to fire leaked intelligence information to congressman nunez in the middle of the nightbrbrhe must be thinking about resignation to save his reputation,22004566.0,22004566,<br/>,comment,1491059696.0,1,False,0.0,nan,22004566,https://graphics8.nytimes.com/images/apps/timespeople/none.png,60.0,nan,0.0,nan,0,approved,1.0,0.0,1491062737,christine knowles,8240236,hood river oregon,nan,nan,0,58def3237c459f24986d7c84,unknown,oped,823.0,23,oped
1491062737,but when oh when will trump be victim to his own curse impatiently waitingbri will only be happy when he is dragged out in handcuffs but is total amorality illegal,22004431.0,22004431,<br/>,comment,1491059160.0,1,False,0.0,nan,22004431,https://graphics8.nytimes.com/images/apps/timespeople/none.png,104.0,nan,0.0,nan,0,approved,1.0,0.0,1491062737,lk,60787329,virginia,nan,nan,0,58def3237c459f24986d7c84,unknown,oped,823.0,23,oped
1491062737,hal9000  totally agree but what about germany britain the rest of the democratic world,22004413.0,22004413,<br/>,comment,1491059067.0,1,False,0.0,nan,22004413,https://graphics8.nytimes.com/images/apps/timespeople/none.png,15.0,nan,0.0,nan,0,approved,1.0,0.0,1491062737,robert court,65476898,brigantine nj,nan,nan,0,58def3237c459f24986d7c84,unknown,oped,823.0,23,oped
1491062689,this will be written about and remembered for centuriesbrthe tweet that sank a thousand shipsbror brthe night of the long spoonsbrbrhe that would sup with the devil brshould carry a long spoon brgene kellybrinherit the wind,22004294.0,22004294,nan,comment,1491058508.0,1,False,0.0,nan,22004294,https://s3.amazonaws.com/pimage.timespeople.nytimes.com/6207/7221/cropped-62077221.jpg?0.2113661104813218,28.0,nan,0.0,nan,0,approved,1.0,0.0,1491062689,fvrivs rvfvs,62077221,worcester ma,nan,nan,0,58def3237c459f24986d7c84,unknown,oped,823.0,23,oped
1491062689,once again gail collins demonstrates that shes the woman and that there is no need for maureen dowds tryingtoohard toolittletoolate comeback efforts in the new york times,22004120.0,22004120,<br/>,comment,1491057706.0,1,False,0.0,nan,22004120,https://graphics8.nytimes.com/images/apps/timespeople/none.png,107.0,nan,0.0,nan,0,approved,1.0,0.0,1491062689,jerry farnsworth,56505895,camden ny,nan,nan,0,58def3237c459f24986d7c84,unknown,oped,823.0,23,oped
1491062689,trump didnt push ryan over the edge he might have given ryan the courage to let everyone know even more clearly who he is,22003971.0,22003971,<br/>,comment,1491057026.0,1,False,0.0,nan,22003971,https://graphics8.nytimes.com/images/apps/timespeople/none.png,43.0,nan,0.0,nan,1,approved,1.0,0.0,1491062689,gary,20862495,upper west side,nan,nan,0,58def3237c459f24986d7c84,unknown,oped,823.0,23,oped
1491062689,and now the dreaded trump cursebrbryou somehow failed to cite hillary clinton as an example gailbrbrwho has suffered more from an association with president trump as his 2016 presidential election opponent than poor hillary didbrbra glaring omission no,22003961.0,22003961,<br/>,comment,1491056977.0,1,False,0.0,nan,22003961,https://graphics8.nytimes.com/images/apps/timespeople/none.png,34.0,nan,0.0,nan,0,approved,1.0,0.0,1491062689,raconteur,69462630,oklahoma city usa,nan,nan,0,58def3237c459f24986d7c84,unknown,oped,823.0,23,oped
1491062689,a year ago you couldnt have made this up the dark side of the force has taken over,22003879.0,22003879,<br/>,comment,1491056593.0,1,False,0.0,nan,22003879,https://graphics8.nytimes.com/images/apps/timespeople/none.png,49.0,nan,0.0,nan,0,approved,1.0,0.0,1491062689,steve hunter,44499492,seattle,nan,nan,0,58def3237c459f24986d7c84,unknown,oped,823.0,23,oped
1491062689,bob from wv is spot on when you are convinced of your reality and not open to other perspectives then no information can be presented that can change your mind i challenge all progressive to find a way to talk through the fog,22003802.0,22003802,<br/>,comment,1491056147.0,1,False,0.0,nan,22003802,https://graphics8.nytimes.com/images/apps/timespeople/none.png,18.0,nan,0.0,nan,0,approved,1.0,0.0,1491062689,rich pein,75907283,la crosse wi,nan,nan,0,58def3237c459f24986d7c84,unknown,oped,823.0,23,oped
1491062689,and with all the chaos incompetence and oh yeah possible treason the work of government on behalf of the people ceases  good grief,22003779.0,22003779,<br/>,comment,1491055998.0,1,False,0.0,nan,22003779,https://graphics8.nytimes.com/images/apps/timespeople/none.png,42.0,nan,0.0,nan,1,approved,1.0,0.0,1491062689,leslie williams,18673009,burlington vt,nan,nan,0,58def3237c459f24986d7c84,unknown,oped,823.0,23,oped
1491062688,the narcissist devours people consumes their output and casts the empty writhing shells asidesam vaknin  ,22003767.0,22003767,<br/>,comment,1491055911.0,1,False,0.0,nan,22003767,https://s3.amazonaws.com/pimage.timespeople.nytimes.com/6674/6113/cropped-66746113.jpg,60.0,nan,0.0,nan,0,approved,1.0,0.0,1491062688,bkw,66746113,usa,nan,nan,0,58def3237c459f24986d7c84,unknown,oped,823.0,23,oped
1491062688,dont forget mitt romney  first he gained respect by stepping out front of the anyone but trump movement  then he groveled for the secretary of state position  anyone with a lick of sense could see that trump was just toying with him,22003756.0,22003756,<br/>,comment,1491055875.0,1,False,0.0,nan,22003756,https://graphics8.nytimes.com/images/apps/timespeople/none.png,89.0,nan,0.0,nan,1,approved,1.0,0.0,1491062688,tm,52587552,los angeles,nan,nan,0,58def3237c459f24986d7c84,unknown,oped,823.0,23,oped
1491062688,this is the trump effect  trump just has to say i respect andrew jackson to make you excited about seeing harriet tubman on your twenty dollar bills  think about it people are actually sending homebaked cookies to employees of the epa  who else could do that for the epa,22003729.0,22003729,<br/>,comment,1491055702.0,1,False,0.0,nan,22003729,https://graphics8.nytimes.com/images/apps/timespeople/none.png,23.0,nan,0.0,nan,0,approved,1.0,0.0,1491062688,phil,69843538,las vegas,nan,nan,0,58def3237c459f24986d7c84,unknown,oped,823.0,23,oped
1491062688,devin nunesi think i have finally figured out the plot behind that story  dt hugely annoyed at the failure of his obama spy tweet to take root decides with bannons help no doubt to seed carefully selected documents by having low level staff pass them along to nunes secretly on the whitehouse lawn in the middle of the night  personally id have chosen a parking garage but i guess i understand the plot was hatched by trump and bannon after all  then nunes loyal leader of the house intelligence committee dutifully reports the documents back to dt  am i making sense so far  nunes then blathers away as dt must have hoped about these secret documents proving dts case against obama picked up and scattered to the winds by fox news no mystery there  so nunes ends up as gail reports forever known as that guy sneaking around the whitehouse lawn in the middle of the night  come to think of it that is better than a parking garage  got to hand it to dtbannongood story tellers           ,22003704.0,22003704,<br/>,comment,1491055526.0,1,False,0.0,nan,22003704,https://graphics8.nytimes.com/images/apps/timespeople/none.png,38.0,nan,0.0,nan,0,approved,1.0,0.0,1491062688,richard miner,68408995,nj,nan,nan,0,58def3237c459f24986d7c84,unknown,oped,823.0,23,oped
1491061976,add my aunt tessie and her friend ceil who lives just down the street in a very lower class area of floridas palm beach county to the dreaded trump curse their mealsonwheels delivery are always late because of the horrific traffic jams caused by that guy in dc and his large contingent coming down to play golf ceil and auntie want him to  stay up north do his job there or twittle his short thumbs whatever but dont come down here so much aint gonna happen,22003900.0,22003900,<br/>,comment,1491056659.0,1,False,0.0,nan,22003900,https://graphics8.nytimes.com/images/apps/timespeople/none.png,79.0,nan,0.0,nan,1,approved,1.0,0.0,1491061976,michael,26169391,sarasota,nan,nan,0,58def3237c459f24986d7c84,unknown,oped,823.0,23,oped
1491061934,ship of fools and someone forgot to put the plug in can we all hope they will all be gone soon drowned before we get sucked into their vortex ,22005028.0,22005028,<br/>,comment,1491061444.0,1,False,0.0,nan,22005028,https://graphics8.nytimes.com/images/apps/timespeople/none.png,37.0,nan,0.0,nan,0,approved,1.0,0.0,1491061934,heysus,36240346,mount vernon wa,nan,nan,0,58def3237c459f24986d7c84,unknown,oped,823.0,23,oped
1491061934,hold their feet to the fire and dont let up media citizens congress men and women feet to the fire,22004806.0,22004806,<br/>,comment,1491060614.0,1,False,0.0,nan,22004806,https://graphics8.nytimes.com/images/apps/timespeople/none.png,89.0,nan,0.0,nan,0,approved,1.0,0.0,1491061934,marti garrison,71638607,arizona,nan,nan,0,58def3237c459f24986d7c84,unknown,oped,823.0,23,oped
1491061934,what reputation  they probably do not give a hoot about things like ethics fair play etc they may not have any children as their stand the environment proves and they do not want to be role models for their kids if any either alibaba and his forty thieves carry on with the ignorami who elected trump ,22004705.0,22004705,<br/>,comment,1491060264.0,1,False,0.0,nan,22004705,https://graphics8.nytimes.com/images/apps/timespeople/none.png,21.0,nan,0.0,nan,0,approved,1.0,0.0,1491061934,hrao,75154315,ny,nan,nan,0,58def3237c459f24986d7c84,unknown,oped,823.0,23,oped
1491061934,melania trump  obituary will read she was the third wife of the most incompetent president in the history of the united states,22004581.0,22004581,<br/>,comment,1491059751.0,1,False,0.0,nan,22004581,https://graphics8.nytimes.com/images/apps/timespeople/none.png,72.0,nan,0.0,nan,0,approved,1.0,0.0,1491061934,treabeton,21611172,new hartford ny,nan,nan,0,58def3237c459f24986d7c84,unknown,oped,823.0,23,oped
1491061934,this is exactly what russia and putin wanted a chaotic mess that has no leadership trump willfully tries to enact policy that does more damage than good they probably didnt think it would be this easy,22004543.0,22004543,<br/>,comment,1491059578.0,1,False,0.0,nan,22004543,https://graphics8.nytimes.com/images/apps/timespeople/none.png,79.0,nan,0.0,nan,0,approved,1.0,0.0,1491061934,knucklehead,72691272,charleston sc,nan,nan,0,58def3237c459f24986d7c84,unknown,oped,823.0,23,oped
1491061934,to all fairness  russia didnt try too hard to help trump was suprisingly easy few stratigic leaks and the enemy is down maybe  russian diplomats miss all this free food but russia got free publicity as a country that defeated famous american democracy kind of david vs golaih priceless,22004448.0,22004448,<br/>,comment,1491059220.0,1,False,0.0,nan,22004448,https://graphics8.nytimes.com/images/apps/timespeople/none.png,20.0,nan,0.0,nan,0,approved,1.0,0.0,1491061934,yulia,7152840,mo,nan,nan,0,58def3237c459f24986d7c84,unknown,oped,823.0,23,oped
1491061933,america your time at the top of the heap is fastending the falsepretense of the founding documents now revealed as a domestic fairy tale in a world of perpetual war and domestic falsecarding it is no wonder the lunatics have taken over the asylum and the late orson welles speaks from the grave  i told you so,22004343.0,22004343,<br/>,comment,1491058727.0,1,False,0.0,nan,22004343,https://graphics8.nytimes.com/images/apps/timespeople/none.png,15.0,nan,0.0,nan,0,approved,1.0,0.0,1491061933,edgar numrich,59896921,portland or,nan,nan,0,58def3237c459f24986d7c84,unknown,oped,823.0,23,oped
