approveDate,commentBody,commentID,commentSequence,commentTitle,commentType,createDate,depth,editorsSelection,parentID,parentUserDisplayName,permID,picURL,recommendations,recommendedFlag,replyCount,reportAbuseFlag,sharing,status,timespeople,trusted,updateDate,userDisplayName,userID,userLocation,userTitle,userURL,inReplyTo,articleID,sectionName,newDesk,articleWordCount,printPage,typeOfMaterial
1491050574,the people most deserving of the curse are people who didnt bother showing up to the polls in november  i hope their apathy laziness sloth stupidity ignorance and irresponsibility is beginning to sink in with them now  i would go so far as to say that i also hope they lose their jobs health insurance clean water clean air and social safety net if it werent for the fact that their children will suffer too  otherwise damn them all,22002488.0,22002488,<br/>,comment,1491048721.0,1,False,0.0,nan,22002488,https://s3.amazonaws.com/pimage.timespeople.nytimes.com/6250/7509/cropped-62507509.jpg?17102112601625179220,10.0,nan,0.0,nan,0,approved,1.0,0.0,1491050574,eb,62507509,earth,nan,nan,0,58def3237c459f24986d7c84,unknown,oped,823.0,23,oped
1491050574,yes trump is toxic  but the world may be the ultimate victim as climate changeglobal warming are denied and and the epa becomes the environmental pollution agency   were all being suffocated in his toxic embrace or is it a choke hold,22002480.0,22002480,<br/>,comment,1491048653.0,1,False,0.0,nan,22002480,https://graphics8.nytimes.com/images/apps/timespeople/none.png,4.0,nan,0.0,nan,0,approved,1.0,0.0,1491050574,paul wortman,57715665,east setauket ny,nan,nan,0,58def3237c459f24986d7c84,unknown,oped,823.0,23,oped
1491050573,when i saw those coal miners posing with trump last week all i could think of was how selfish and despicable they seemed being excited about propping up an unnecessary and destructive industry that has a clear link to climate change that will inevitably lead to hardship and misery for millions at some point and also results in the spewing of pollutants into the air that will make millions sick  these poor miners were desperate for jobs but trump turned them into villains in my eyes,22002468.0,22002468,<br/>,comment,1491048549.0,1,False,0.0,nan,22002468,https://graphics8.nytimes.com/images/apps/timespeople/none.png,7.0,nan,1.0,nan,0,approved,1.0,0.0,1491050573,joe mag,48516343,lanoka harbor nj,nan,nan,0,58def3237c459f24986d7c84,unknown,oped,823.0,23,oped
1491050573,paul krugman nailed what djt does it is cultural symbolism and cultural affectation he feeds it to his base on twitter and fox djt is the ultimate salesman selling snake oil and after all politics is about selling a product and votes are the revenue truth facts numbers and reality must rule be careful with the snark it is funny and probably satisfying to the hard core progressives but we need the common sense and decency of a few defectors in congress ie the tuesday group to continue blocking the trump agenda for 2 years they need to be informed and groomed not alienated,22002458.0,22002458,<br/>,comment,1491048466.0,1,False,0.0,nan,22002458,https://s3.amazonaws.com/pimage.timespeople.nytimes.com/5425/6110/cropped-54256110.jpg,7.0,nan,0.0,nan,1,approved,1.0,0.0,1491050573,tom,54256110,cadillac mi,nan,nan,0,58def3237c459f24986d7c84,unknown,oped,823.0,23,oped
1491050310,this column is priceless while i doubt any trump supporter will care its a reminder to republicans and trumps cabinet appointees that an association with the president is poison but i will say that paul ryan was served poetic justice for his mean spirited incompetence on handling the health care fiasco,22002517.0,22002517,<br/>,comment,1491048933.0,1,False,0.0,nan,22002517,https://graphics8.nytimes.com/images/apps/timespeople/none.png,18.0,nan,0.0,nan,1,approved,1.0,0.0,1491050310,liberally minded,63258400,new york ny,nan,nan,0,58def3237c459f24986d7c84,unknown,oped,823.0,23,oped
1491050292,experiencing schadenfreude  a feeling of enjoyment that comes from seeing or hearing about the troubles of other peoplemerited or not  as some of   trumps minions get their due is an irrelevant ineffective balm for the temporary or more permanent harms that they  have caused to many many people and even to systems whether or not such people whatever their status connections real power to influence etc fall remain where they are are resurrected again etc has yet to create seriously needed healthier propeoplesocietal changes consider the  documented and ongoing processes of willful blindness and deafness of historical and yet to be created inequities in americas regional and national cultures by trumpisms fellow american supporters family friends neighbors colleagues strangers in what ways can does experiencing and sharing schadenfreude about wounded official and lay trumpists  and their doings and undoings help regarding ongoing unavailable and inaccessible opportunities and sharing of necessary internal and external resources for developing and sustaining levels and qualities of well being for and by many a long sentence as long and weighty as the 4 year sentence which some of us somehow enabled consider in  what ways can our waking and problemsolving dreaming hours energies skill and abilities be better channeled to effectively bridge trumpisms walls of mistrust altfacts fears and a range of actual harms schadenfreude,22002484.0,22002484,<br/>,comment,1491048701.0,1,True,0.0,nan,22002484,https://graphics8.nytimes.com/images/apps/timespeople/none.png,106.0,nan,2.0,nan,0,approved,1.0,0.0,1491050293,s einstein,56645726,jerusalem,nan,nan,0,58def3237c459f24986d7c84,unknown,oped,823.0,23,oped
1491048376,great columnbradmiral harward smartest move turning  trump down,22001986.0,22001986,<br/>,comment,1491044443.0,1,False,0.0,nan,22001986,https://graphics8.nytimes.com/images/apps/timespeople/none.png,24.0,nan,0.0,nan,0,approved,1.0,0.0,1491048376,marc brier,62275005,rome,nan,nan,0,58def3237c459f24986d7c84,unknown,oped,823.0,23,oped
1491048376,the flaming downward spiral that is the il turmpolini administration is accelerating  god help the united states  resist  ,22001567.0,22001567,<br/>,comment,1491035761.0,1,False,0.0,nan,22001567,https://s3.amazonaws.com/pimage.timespeople.nytimes.com/5873/7979/cropped-58737979.jpg?0.3939044170547277,15.0,nan,0.0,nan,1,approved,1.0,0.0,1491048376,paul leighty,58737979,seatte wa,nan,nan,0,58def3237c459f24986d7c84,unknown,oped,823.0,23,oped
1491048376,gail is jealous maureen famously called dick cheney darth vader and it famously stuck  entered the language actually a lot of people dont remember seamus mitt romneys dog that she endlessly reminded us hed once strapped to the top of his car for 12 hours on that canadian family trip so shes at it again trying to get the image of devin nunes skulking around the white house lawn accepted as an american legend she should focus instead on coming up with an immortal nickname for pence and no your holiness wont do that ones already taken by a liberalbrbrryan wasnt rolled by trump ryan was rolled by his lack of similarities to sam rayburn if youre going to effectively herd cats you really need to know how trump would have accepted just about anything that got us beyond obamacare and on to the real things he was elected to tend to what we got was the ahca and the dawning realization by enough republicans that they blew it by letting the aca be enacted then implemented you dont repeal an entitlement after its conferred and millions of voters have become dependent on it and if youre going to replace it the replacement had better do at least as much as what it replaces but better that the ahca didnt do that wasnt trumps fault it was ryansbrbrreince  i have nothing to say about reince except that the name is suspicious spicer may melissa mccarthy live foreverbrbrall the rest good for a laugh on to taxes regulation and immigration,22000980.0,22000980,<br/>,comment,1491021350.0,1,False,0.0,nan,22000980,https://s3.amazonaws.com/pimage.timespeople.nytimes.com/4712/3844/cropped-47123844.jpg?0.06419149620228637,6.0,nan,8.0,nan,0,approved,1.0,1.0,1491052167,richard luettgen,47123844,new jersey,nan,nan,0,58def3237c459f24986d7c84,unknown,oped,823.0,23,oped
1491048376,how to characterized those people who are either trump staff or congressmen and senators that are busy enacting his programs and theirsbrbrthe question is what do they get out of it no one does anything for no reason it may seem that way at times but all his enablers have a motive spicer gives me the creeps the first time i saw him speak i immediately thought goebbels but then conway came on and they both fit the same mold brbrnow we also have nunez who comes from a district where the majority of residents can not vote he is supported by some very wealthy raisin growers this is grapes of wrath country he has not had much opposition trump is his passport to bigger things maybe a post in siberia and ryan he has had a dislike for anyone who has to rely on public assistance except himself of course brbrso we have a whole menagerie of misfits and ideological nihilists getting their chance to see just how miserable they can make everyone else they all need each other to do this so if you wonder how any of them can stomach even being around trump they compliment each otherbrbrbut that does not answer the question we see a whole horde of opinions speculation even some sane ideas and the usual answer is follow the money but that does not seem to be the motive here the other common comment is fascism they exhibit the characteristics of il duce and others we know trump runs his organizations like that they all want to keep the rest of us in line,22000579.0,22000579,<br/>,comment,1491017011.0,1,False,0.0,nan,22000579,https://s3.amazonaws.com/pimage.timespeople.nytimes.com/5361/2425/cropped-53612425.jpg?18093889456285707,11.0,nan,0.0,nan,0,approved,1.0,1.0,1491048376,david underwood,53612425,citrus  heights,nan,nan,0,58def3237c459f24986d7c84,unknown,oped,823.0,23,oped
1491048376,hehehe indeed brbri just finished rewatching the homeland episode called sock puppets  this seasons homeland cant hold a candle to the 247 series running on multiple stations  brbrtake your pick trumpland thru the eyes of democrats of republicans of trump supporters of moderates and independentsbrbrits becoming one of the most watched series ever with a continually expanding cast of characters and it actually makes any old cable series even one based on us security and the spooks who control it seem tame brbrwill flynn get immunity  more important what will he do when he doesnt will preibus survive will spicer lose it one day rip up his script and stare into the camera and yell you man mr president im mad as hell and im not gonna take it any more as he stomps off into the sunset to take a job as pundit on foxbrbryou just never know now do you rumor has it trump is getting so harried over russia he may just resign brbrgood thing comey hasnt debugged trump tower from 3 decades of gathering evidence of large scale organized crime syndicates russian as well as mafia who rent space therebrbrif trump goes home hes likely to become very very chatty,22000511.0,22000511,<br/>,comment,1491016284.0,1,False,0.0,nan,22000511,https://s3.amazonaws.com/pimage.timespeople.nytimes.com/2073/520/cropped-2073520.jpg?0.18587254704312467,13.0,nan,0.0,nan,0,approved,1.0,1.0,1491048376,christine mcm,2073520,massachusetts,nan,nan,0,58def3237c459f24986d7c84,unknown,oped,823.0,23,oped
1491048376,trump officials might want to reread the history of the watergate era when quite a few nixon officials went to prison and had watergate permanently affixed to their name a scarlet w there was john mitchell ag white house staffers j r haldeman and john erllichman legal counselors to the president john dean and charles colson james mccord g gordon liddy and howard hunt they committed crimes from which they had nothing to gain ok except liddy who parlayed drime into a business opportunity at least in russia loyal officials get part of the proceeds   brbrit takes a generation or so for memories like watergate to fade from the memories of eager young staffers and veterans of government service alike perhaps they should have a little online selfpaced training program with an comprehension assessment at the end on avoiding criminality in your job im guessing spicer and conway might have to take it a few times brbrits also important to recall that the russian connections are a far bigger deal than watergate or the bridge gate scandal that just sent two christie loyalists to prison ,21999834.0,21999834,<br/>,comment,1491010706.0,1,False,0.0,nan,21999834,https://graphics8.nytimes.com/images/apps/timespeople/none.png,30.0,nan,1.0,nan,0,approved,1.0,1.0,1491048376,look ahead,18426496,wa,nan,nan,0,58def3237c459f24986d7c84,unknown,oped,823.0,23,oped
1491048273,they are all on automatic pilot oblivious and selfserving they dont care if you live or die unless youre in the 1 who feel being taxed is poisonbrbrlets make a deal free these selfish people from their taxes then they must go away and leave us alone forever,22002410.0,22002410,<br/>,comment,1491048118.0,1,False,0.0,nan,22002410,https://s3.amazonaws.com/pimage.timespeople.nytimes.com/6532/6277/cropped-65326277.jpg?0.5299402666788198,9.0,nan,0.0,nan,0,approved,1.0,0.0,1491048273,david henry,65326277,concord,nan,nan,0,58def3237c459f24986d7c84,unknown,oped,823.0,23,oped
1491048273,gails column would make good bedtime stories for our childrenlife lessons to be learned  brbrmy grandma was big on reading us stories that had a characterdevelopment message with a moralabe lincoln stories george washington aesops fables daulaires book of greek myths  after she read a story we discussed it to make sure we understand the point and our character would be bolstered from the experiencebrbrsome of these stories were hero tales of overcoming and accomplishment despite the oddsdefinitely does not pertain to donald trump or his millionairebillionaire cabinet probably some of his cabinet were not born rich but my hunch is they made their fortune the oldfashioned way by exploiting labor and ripping off clientslike we know whobrbrother stories were about mistakes characters made that made them look like fools or wrecked their reputations by engaging in stupid behaviorthe emperor who had no clothes eg trump chicken little perhaps the entire gop when obama was president and the boy who cried wolf bannon breitbart fox newsbrbrso each night we could read our children a character story from gails column and discuss it with them  brbrtonight paul ryan once upon a time there was a teenager whose father died amp the family received ssi but then paul read ayn rand sciencefiction novels amp his lifes ambition was to take away ss medicare amp medicaid from everyone else later as house speaker paul sold his soul to we know who sleep tight,22002407.0,22002407,<br/>,comment,1491048075.0,1,False,0.0,nan,22002407,https://s3.amazonaws.com/pimage.timespeople.nytimes.com/2062/0430/cropped-20620430.jpg,38.0,nan,1.0,nan,0,approved,1.0,0.0,1491048273,pb,20620430,cny,nan,nan,0,58def3237c459f24986d7c84,unknown,oped,823.0,23,oped
1491048273,this presidency and its collection of liars scam artists and traitors are a sick joke on america,22002393.0,22002393,<br/>,comment,1491047985.0,1,False,0.0,nan,22002393,https://graphics8.nytimes.com/images/apps/timespeople/none.png,9.0,nan,0.0,nan,0,approved,1.0,0.0,1491048273,demosthenes,45202528,chicago,nan,nan,0,58def3237c459f24986d7c84,unknown,oped,823.0,23,oped
1491048273,and then theres good ole boy rex who is so socially awkward that he has directed diplomats to not look him in the eye his acute shyness is off the charts and is the exact opposite of what is needed as secretary of state but he knows hes goin down under the bus so no worries there he knows that once the kick comes he can hide behind the wheel well,22002389.0,22002389,<br/>,comment,1491047974.0,1,False,0.0,nan,22002389,https://graphics8.nytimes.com/images/apps/timespeople/none.png,8.0,nan,1.0,nan,0,approved,1.0,0.0,1491048273,frau greta,74391740,somewhere in new jersey,nan,nan,0,58def3237c459f24986d7c84,unknown,oped,823.0,23,oped
1491048273,i think about the onair apologists for the orange autocrat as well   brbrsure guys like roger stone and jeffrey lord lost any credibility with thinking people decades ago  brbrbut the youthful propagandists like kayleigh mcenany  georgetown harvard law telegenic could have a bright future   but someone cruelly convinced this christian conservative that theres glory to be found in defending the indefensible in making excuses for vulgarity incoherence petulance and lies  sad,22002383.0,22002383,<br/>,comment,1491047924.0,1,False,0.0,nan,22002383,https://graphics8.nytimes.com/images/apps/timespeople/none.png,14.0,nan,1.0,nan,0,approved,1.0,0.0,1491048273,evangelos,62641700,brooklyn,nan,nan,0,58def3237c459f24986d7c84,unknown,oped,823.0,23,oped
1491048273,to accept any appointment by the knownothing dt one must have very low to nonexistent selfesteem to begin with the same goes for the voter base that endorsed the bullying bankruptcy artist,22002380.0,22002380,<br/>,comment,1491047898.0,1,False,0.0,nan,22002380,https://graphics8.nytimes.com/images/apps/timespeople/none.png,5.0,nan,0.0,nan,0,approved,1.0,0.0,1491048273,doetze,8087877,netherlands,nan,nan,0,58def3237c459f24986d7c84,unknown,oped,823.0,23,oped
1491048273,maybe hill had it right when she estimated half trump supporters were from a basket of deplorables it certainly seems his administration choices score a higher batting average than 500 for deplorable hits,22002375.0,22002375,<br/>,comment,1491047867.0,1,False,0.0,nan,22002375,https://graphics8.nytimes.com/images/apps/timespeople/none.png,13.0,nan,0.0,nan,0,approved,1.0,0.0,1491048273,lawrence zajac,65728425,williamsburg,nan,nan,0,58def3237c459f24986d7c84,unknown,oped,823.0,23,oped
1491048273,dear ms collinsbrbri write to express my gratitude  you reminded me there is a dark mean humor hovering over all of thisbrbri felt a little guilty laughing,22002363.0,22002363,<br/>,comment,1491047794.0,1,False,0.0,nan,22002363,https://graphics8.nytimes.com/images/apps/timespeople/none.png,7.0,nan,0.0,nan,0,approved,1.0,0.0,1491048273,kcbob,23225364,kansas city mo,nan,nan,0,58def3237c459f24986d7c84,unknown,oped,823.0,23,oped
1491048273,no one who associates him or herself with trump ends up looking the better for it except newt gingrich,22002359.0,22002359,<br/>,comment,1491047773.0,1,False,0.0,nan,22002359,https://graphics8.nytimes.com/images/apps/timespeople/none.png,1.0,nan,0.0,nan,0,approved,1.0,0.0,1491048273,neutral observer,46907074,nyc,nan,nan,0,58def3237c459f24986d7c84,unknown,oped,823.0,23,oped
1491048273,how ironic that the man who surrounds himself with goldplated splendor now has the antimidas touch the next name added to this list may be mike pence before he became one of trumps human shields his colleagues in congress thought of him as a decent man however much they may have disagreed with his political positions whats he going to do when the shows over and hes squandered what remains of his credibility ,22002326.0,22002326,<br/>,comment,1491047544.0,1,False,0.0,nan,22002326,https://graphics8.nytimes.com/images/apps/timespeople/none.png,13.0,nan,0.0,nan,0,approved,1.0,0.0,1491048273,smd,39535352,barcelona,nan,nan,0,58def3237c459f24986d7c84,unknown,oped,823.0,23,oped
1491048273,also on the smeared forever by association with donald trump the executive order remember when issuing executive orders was considered treasonous of course that was when president obama was doing them trump has taken the eo to a new level of semiimportance none dare call it treason,22002311.0,22002311,<br/>,comment,1491047419.0,1,False,0.0,nan,22002311,https://graphics8.nytimes.com/images/apps/timespeople/none.png,9.0,nan,0.0,nan,0,approved,1.0,0.0,1491048273,stephen beard,52444732,troy oh,nan,nan,0,58def3237c459f24986d7c84,unknown,oped,823.0,23,oped
1491048273,what was with his walk out the door the so called president is losing it bigly he must be tortured knowing this job is not what he thought it would be ,22002299.0,22002299,<br/>,comment,1491047336.0,1,False,0.0,nan,22002299,https://graphics8.nytimes.com/images/apps/timespeople/none.png,9.0,nan,0.0,nan,0,approved,1.0,0.0,1491048273,jame choi,70688791,casper,nan,nan,0,58def3237c459f24986d7c84,unknown,oped,823.0,23,oped
1491048273,it aint the trump curse so much as trump like any republican is slimy  slimy things pick up dirt like a dyson on steroidsbrbri look at that list and think i would never want to have dinner with any of those people  they have no there there  nothing intriguing  that to me is the story  republicans people you dont really care to have dinner with because they are empty,22002298.0,22002298,<br/>,comment,1491047331.0,1,False,0.0,nan,22002298,https://graphics8.nytimes.com/images/apps/timespeople/none.png,9.0,nan,0.0,nan,0,approved,1.0,0.0,1491048273,mogwai,69618335,ct,nan,nan,0,58def3237c459f24986d7c84,unknown,oped,823.0,23,oped
1491048273,these people were the best trump could find who will he get when these quit or are put in jail that is really scary,22002282.0,22002282,<br/>,comment,1491047235.0,1,False,0.0,nan,22002282,https://graphics8.nytimes.com/images/apps/timespeople/none.png,7.0,nan,0.0,nan,0,approved,1.0,0.0,1491048273,thomas renner,49668339,new york city,nan,nan,0,58def3237c459f24986d7c84,unknown,oped,823.0,23,oped
1491048273,you dont have to be a geologist to work in a coal mine but if you hear a rumble you know its time to get out everyone has heard the rumble except the miners coal is old technology the country is going forward with natural gas and sustainable sources do miners have coal in their ears they are not the captains of that industry and do not have to go down with that ship,22002257.0,22002257,<br/>,comment,1491047018.0,1,False,0.0,nan,22002257,https://graphics8.nytimes.com/images/apps/timespeople/none.png,10.0,nan,1.0,nan,0,approved,1.0,0.0,1491048273,dj,48241582,nj,nan,nan,0,58def3237c459f24986d7c84,unknown,oped,823.0,23,oped
1491048273,i would wish snl became a daily  i also wonder if the emmies will abandon the award for comedy writing no one make this up,22002006.0,22002006,<br/>,comment,1491044687.0,1,False,0.0,nan,22002006,https://graphics8.nytimes.com/images/apps/timespeople/none.png,6.0,nan,0.0,nan,0,approved,1.0,0.0,1491048273,chris,1614882,nowhere i can tell you,nan,nan,0,58def3237c459f24986d7c84,unknown,oped,823.0,23,oped
1491048273,is it true that in the house cafeteria russian dressing is now called american dressing,22001873.0,22001873,<br/>,comment,1491043153.0,1,False,0.0,nan,22001873,https://s3.amazonaws.com/pimage.timespeople.nytimes.com/5885/2258/cropped-58852258.jpg?0.5861089222598821,9.0,nan,0.0,nan,0,approved,1.0,0.0,1491048273,michael steinberg,58852258,westchester ny,nan,nan,0,58def3237c459f24986d7c84,unknown,oped,823.0,23,oped
1491048273,he that walketh with wise men shall be wise but a companion of fools shall be destroyed   proverbs 1320,22001864.0,22001864,<br/>,comment,1491043078.0,1,False,0.0,nan,22001864,https://graphics8.nytimes.com/images/apps/timespeople/none.png,9.0,nan,0.0,nan,0,approved,1.0,0.0,1491048273,fred,26826622,up north,nan,nan,0,58def3237c459f24986d7c84,unknown,oped,823.0,23,oped
1491048273,i can always count on gail to lift me out of my trump doldrums the hardest thing is not laughing until im crying because this whole damn trump scene is so pathetic im afraid that if i cryi might not be able to stopbron a lighter note i do have a crush on gails way with the written word ,22001296.0,22001296,<br/>,comment,1491027373.0,1,False,0.0,nan,22001296,https://graphics8.nytimes.com/images/apps/timespeople/none.png,5.0,nan,0.0,nan,0,approved,1.0,0.0,1491048273,mary,61016247,phoenix,nan,nan,0,58def3237c459f24986d7c84,unknown,oped,823.0,23,oped
1491047108,how about fox news  dont they belong in  this waste heap,22002262.0,22002262,<br/>,comment,1491047077.0,1,False,0.0,nan,22002262,https://s3.amazonaws.com/pimage.timespeople.nytimes.com/5456/0259/cropped-54560259.jpg?0.06233156391407363,15.0,nan,0.0,nan,0,approved,1.0,1.0,1491047108,tom,54560259,pittsburgh,nan,nan,0,58def3237c459f24986d7c84,unknown,oped,823.0,23,oped
1491046806,i love your ending  it is so ironic that flynn who yelled lock her up is now seeking immunity to avoid going to jail  what is that chinese quote about living long enough to see your enemys dead body float by on the river  it was used awhile back in reference to kenneth starr and the clintons  ,22002209.0,22002209,<br/>,comment,1491046628.0,1,False,0.0,nan,22002209,https://graphics8.nytimes.com/images/apps/timespeople/none.png,22.0,nan,0.0,nan,0,approved,1.0,0.0,1491046806,pa,42222367,mass,nan,nan,0,58def3237c459f24986d7c84,unknown,oped,823.0,23,oped
1491046806,and to think that senior advisor bannon is sort of organizing this three ring circus  ,22002208.0,22002208,<br/>,comment,1491046628.0,1,False,0.0,nan,22002208,https://s3.amazonaws.com/pimage.timespeople.nytimes.com/4150/585/cropped-4150585.jpg?20373613141707934187,9.0,nan,0.0,nan,0,approved,1.0,0.0,1491046806,chuck w,4150585,san antonio,nan,nan,0,58def3237c459f24986d7c84,unknown,oped,823.0,23,oped
